Symbol,Name,Market Cap,Country,Sector,Industry,Move
ABEO,Abeona Therapeutics Inc. Common Stock,261260890.0,United States,Health Care,Biotechnology: Pharmaceutical Preparations,SB
PANL,Pangaea Logistics Solutions Ltd. Common Shares,259837584.0,United States,Consumer Discretionary,Marine Transportation,SB
ODV,Osisko Development Corp. Common Shares,259502443.0,Canada,Basic Materials,Precious Metals,SB
GHI,Greystone Housing Impact Investors LP Beneficial Unit Certificates representing assignments of limited partnership interests,258523906.0,United States,Finance,Finance: Consumer Services,SB
BWFG,Bankwell Financial Group Inc. Common Stock,258468466.0,United States,Finance,Major Banks,B
IRBT,iRobot Corporation Common Stock,258221928.0,United States,Consumer Discretionary,Consumer Electronics/Appliances,H
LUNG,Pulmonx Corporation Common Stock,257658410.0,United States,Health Care,Medical/Dental Instruments,SB
OCGN,Ocugen Inc. Common Stock,257294071.0,United States,Health Care,Biotechnology: Biological Products (No Diagnostic Substances),SB
ANIK,Anika Therapeutics Inc. Common Stock,257176666.0,United States,Health Care,Medical/Dental Instruments,SB
FREY,FREYR Battery Inc. Common Stock,257097443.0,Luxembourg,Miscellaneous,Industrial Machinery/Components,H
MYPS,PLAYSTUDIOS Inc.  Class A Common Stock,256849926.0,United States,Technology,Computer Software: Prepackaged Software,B
AZUL,Azul S.A. American Depositary Shares (each representing three preferred shares),256289774.0,Brazil,Consumer Discretionary,Air Freight/Delivery Services,B
AMPY,Amplify Energy Corp. Common Stock,256120384.0,United States,Energy,Oil & Gas Production,SB
ZYXI,Zynex Inc. Common Stock,255082815.0,United States,Health Care,Biotechnology: Electromedical & Electrotherapeutic Apparatus,SB
FVCB,FVCBankcorp Inc. Common Stock,254680325.0,United States,Finance,Major Banks,H
PINE,Alpine Income Property Trust Inc. Common Stock,254201738.0,United States,Real Estate,Real Estate Investment Trusts,SB
NAK,Northern Dynasty Minerals Ltd. Common Stock,254088898.0,Canada,Basic Materials,Precious Metals,SB
MODV,ModivCare Inc. Common Stock,253249363.0,United States,Consumer Discretionary,Transportation Services,SB
ONIT,Onity Group Inc. Common Stock,252734871.0,United States,Finance,Finance: Consumer Services,SB
CHMG,Chemung Financial Corp Common Stock,252299222.0,United States,Finance,Major Banks,B
ELMD,Electromed Inc. Common Stock,252048549.0,United States,Health Care,Biotechnology: Electromedical & Electrotherapeutic Apparatus,SB
MBCN,Middlefield Banc Corp. Common Stock,251493357.0,United States,Finance,Major Banks,H
BLFY,Blue Foundry Bancorp Common Stock,250759014.0,United States,Finance,Banks,H
CATX,Perspective Therapeutics Inc. Common Stock,250749773.0,United States,Health Care,Medical/Dental Instruments,SB
ASUR,Asure Software Inc Common Stock,250137983.0,United States,Technology,EDP Services,SB
SAMG,Silvercrest Asset Management Group Inc. Class A Common Stock,249841984.0,United States,Finance,Investment Managers,SB
HRTX,Heron Therapeutics Inc. Common Stock,249435656.0,United States,Health Care,Biotechnology: Pharmaceutical Preparations,SB
CNL,Collective Mining Ltd. Common Shares,248422258.0,,,,SB
RMAX,RE/MAX Holdings Inc. Class A Common Stock,247978776.0,United States,Finance,Real Estate,H
LXRX,Lexicon Pharmaceuticals Inc. Common Stock,247694521.0,United States,Health Care,Biotechnology: Pharmaceutical Preparations,SB
WHF,WhiteHorse Finance Inc. Common Stock,246841595.0,United States,Finance,Finance Companies,H
EVBN,Evans Bancorp Inc. Common Stock,246827059.0,United States,Finance,Major Banks,H
TLS,Telos Corporation Common Stock,246817877.0,United States,Technology,EDP Services,SB
VSTM,Verastem Inc. Common Stock,244340828.0,United States,Health Care,Biotechnology: Pharmaceutical Preparations,SB
KULR,KULR Technology Group Inc. Common Stock,244219701.0,United States,Technology,Electrical Products,SB
INGN,Inogen Inc Common Stock,243424181.0,United States,Health Care,Industrial Specialties,H
ILPT,Industrial Logistics Properties Trust Common Shares of Beneficial Interest,243411473.0,United States,Real Estate,Real Estate Investment Trusts,B
XFLT,XAI Octagon Floating Rate & Alternative Income Trust Common Shares of Beneficial Interest,243314130.0,United States,Finance,Investment Managers,SB
BMEA,Biomea Fusion Inc. Common Stock,242799203.0,United States,Health Care,Biotechnology: Pharmaceutical Preparations,SB
TBI,TrueBlue Inc. Common Stock,242383308.0,United States,Consumer Discretionary,Professional Services,SB
SVCO,Silvaco Group Inc. Common Stock,241936138.0,United States,Technology,Computer Software: Prepackaged Software,SB
PFMT,Performant Financial Corporation Common Stock,241920315.0,United States,Consumer Discretionary,Other Consumer Services,SB
ZNTL,Zentalis Pharmaceuticals Inc. Common Stock,241589706.0,United States,Health Care,Biotechnology: Pharmaceutical Preparations,B
TTEC,TTEC Holdings Inc. Common Stock,241030920.0,United States,Consumer Discretionary,Professional Services,B
FINW,FinWise Bancorp Common Stock,238197215.0,United States,Finance,Major Banks,SB
LCNB,LCNB Corporation Common Stock,237900282.0,United States,Finance,Major Banks,H
ACB,Aurora Cannabis Inc. Common Shares,237774380.0,Canada,Health Care, Medicinal Chemicals and Botanical Products ,B
TCRX,TScan Therapeutics Inc. Common Stock,237499143.0,United States,Health Care,Biotechnology: Biological Products (No Diagnostic Substances),SB
AEVA,Aeva Technologies Inc. Common Stock,236545496.0,United States,Consumer Discretionary,Auto Parts:O.E.M.,SB
ESOA,Energy Services of America Corporation Common Stock,236297968.0,United States,Industrials,Water Sewer Pipeline Comm & Power Line Construction,SB
PGEN,Precigen Inc. Common Stock,235730336.0,United States,Health Care,Biotechnology: Pharmaceutical Preparations,SB
BHR,Braemar Hotels & Resorts Inc. Common Stock,235488609.0,United States,Real Estate,Real Estate Investment Trusts,H
PERF,Perfect Corp. Class A Ordinary Share,235270430.0,Taiwan,Technology,Computer Software: Prepackaged Software,B
LFCR,Lifecore Biomedical Inc. Common Stock,235135721.0,United States,Health Care,Biotechnology: Pharmaceutical Preparations,B
STRO,Sutro Biopharma Inc. Common Stock,234182779.0,United States,Health Care,Biotechnology: Biological Products (No Diagnostic Substances),SB
FUNC,First United Corporation Common Stock,233258618.0,United States,Finance,Major Banks,H
DMAC,DiaMedica Therapeutics Inc. Common Stock,233045172.0,United States,Health Care,Biotechnology: Pharmaceutical Preparations,SB
PLL,Piedmont Lithium Inc. Common Stock,232862831.0,United States,Industrials,Mining & Quarrying of Nonmetallic Minerals (No Fuels),B
TBN,Tamboran Resources Corporation Common stock,232566880.0,,Energy,Oil & Gas Production,SB
ISTR,Investar Holding Corporation Common Stock,232343683.0,United States,Finance,Major Banks,SB
TZOO,Travelzoo Common Stock,231366436.0,United States,Consumer Discretionary,Advertising,SB
AMPX,Amprius Technologies Inc. Common Stock,229670172.0,United States,Miscellaneous,Industrial Machinery/Components,SB
DSX,Diana Shipping inc. common stock,229129171.0,Greece,Consumer Discretionary,Marine Transportation,B
BNTC,Benitec Biopharma Inc. Common Stock,228681786.0,United States,Health Care,Biotechnology: Pharmaceutical Preparations,SB
RMBL,RumbleOn Inc. Class B Common Stock,228142653.0,United States,Technology,EDP Services,SB
CIO,City Office REIT Inc. Common Stock,226870411.0,Canada,Real Estate,Real Estate Investment Trusts,B
AKA,a.k.a. Brands Holding Corp. Common Stock,226853179.0,,Consumer Discretionary,Catalog/Specialty Distribution,B
CTRN,Citi Trends Inc. Common Stock,225635833.0,United States,Consumer Discretionary,Clothing/Shoe/Accessory Stores,SB
NYXH,Nyxoah SA Ordinary Shares,225554200.0,Belgium,Health Care,Medical/Dental Instruments,SB
ONL,Orion Office REIT Inc. Common Stock,225469642.0,United States,Real Estate,Real Estate Investment Trusts,H
HMST,HomeStreet Inc. Common Stock,225347902.0,United States,Finance,Major Banks,B
BCBP,BCB Bancorp Inc. (NJ) Common Stock,225033257.0,United States,Finance,Savings Institutions,B
FXNC,First National Corporation Common Stock,223719806.0,United States,Finance,Major Banks,H
NVX,NOVONIX Limited American Depository Shares,223595558.0,Australia,Miscellaneous,Industrial Machinery/Components,SB
LXEO,Lexeo Therapeutics Inc. Common Stock,223195142.0,United States,Health Care,Biotechnology: Biological Products (No Diagnostic Substances),SB
AOMR,Angel Oak Mortgage REIT Inc. Common Stock,222886859.0,United States,Finance,Real Estate,B
CIA,Citizens Inc. Class A Common Stock ($1.00 Par),221585193.0,United States,Finance,Life Insurance,SB
SOPH,SOPHiA GENETICS SA Ordinary Shares,221457748.0,Switzerland,Health Care,Biotechnology: Biological Products (No Diagnostic Substances),SB
MFIN,Medallion Financial Corp. Common Stock,220989026.0,United States,Finance,Finance: Consumer Services,B
AVNW,Aviat Networks Inc. Common Stock,220812142.0,United States,Technology,Radio And Television Broadcasting And Communications Equipment,SB
MGNX,MacroGenics Inc. Common Stock,219044434.0,United States,Health Care,Biotechnology: Pharmaceutical Preparations,B
INBX,Inhibrx Biosciences Inc. Common Stock,218586150.0,United States,Health Care,Biotechnology: Biological Products (No Diagnostic Substances),H
DOUG,Douglas Elliman Inc. Common Stock,218459128.0,United States,Finance,Real Estate,SB
WRN,Western Copper and Gold Corporation Common Stock,218041104.0,Canada,Basic Materials,Metal Mining,SB
ESCA,Escalade Incorporated Common Stock,216485911.0,United States,Consumer Discretionary,Recreational Games/Products/Toys,SB
FCEL,FuelCell Energy Inc. Common Stock,216188883.0,United States,Energy,Industrial Machinery/Components,H
MED,MEDIFAST INC Common Stock,215912764.0,United States,Consumer Staples,Packaged Foods,H
IAUX,i-80 Gold Corp. Common Shares,215272738.0,Canada,Basic Materials,Precious Metals,B
SERA,Sera Prognostics Inc. Class A Common Stock,214793100.0,United States,Health Care,Medical Specialities,SB
GROY,Gold Royalty Corp. Common Shares,214720700.0,Canada,Basic Materials,Precious Metals,SB
VLN,Valens Semiconductor Ltd. Ordinary Shares,214570931.0,,Technology,Semiconductors,SB
ALEC,Alector Inc. Common Stock,214472405.0,United States,Health Care,Biotechnology: Biological Products (No Diagnostic Substances),SB
KYTX,Kyverna Therapeutics Inc. Common Stock,213699479.0,United States,Health Care,Biotechnology: Biological Products (No Diagnostic Substances),SB
NUTX,Nutex Health Inc. Common Stock,212749927.0,United States,Consumer Discretionary,Business Services,SB
LANV,Lanvin Group Holdings Limited Ordinary Shares,212173133.0,Cayman Islands,Finance,Blank Checks,H
LOGC,ContextLogic Inc. Class A Common Stock,212120394.0,United States,Consumer Discretionary,Catalog/Specialty Distribution,H
MOLN,Molecular Partners AG American Depositary Shares,211941916.0,Switzerland,Health Care,Biotechnology: Biological Products (No Diagnostic Substances),SB
SANG,Sangoma Technologies Corporation Common Shares,211330377.0,Canada,Technology,Computer Software: Programming Data Processing,SB
RELL,Richardson Electronics Ltd. Common Stock,209956147.0,United States,Technology,Electronic Components,SB
RGCO,RGC Resources Inc. Common Stock,209896083.0,United States,Utilities,Oil & Gas Production,SB
FSFG,First Savings Financial Group Inc. Common Stock,209676162.0,United States,Finance,Savings Institutions,SB
ACRV,Acrivon Therapeutics Inc. Common Stock,209547272.0,United States,Health Care,Biotechnology: Pharmaceutical Preparations,SB
AFCG,Advanced Flower Capital Inc. Common Stock,209428539.0,United States,Finance,Real Estate,SB
NNBR,NN Inc. Common Stock,209275152.0,United States,Industrials,Industrial Machinery/Components,SB
FOA,Finance of America Companies Inc. Class A Common Stock,209149817.0,United States,Finance,Finance: Consumer Services,B
DRTS,Alpha Tau Medical Ltd. Ordinary Shares,209011836.0,Israel,Health Care,Medical/Dental Instruments,SB
CYBN,Cybin Inc. Common Shares,208515621.0,Canada,Health Care,Biotechnology: Pharmaceutical Preparations,SB
MAPS,WM Technology Inc. Class A Common Stock ,207892846.0,United States,Technology,Computer Software: Prepackaged Software,SB
MYFW,First Western Financial Inc. Common Stock,207778172.0,United States,Finance,Major Banks,B
CMPX,Compass Therapeutics Inc. Common Stock,207759648.0,United States,Health Care,Biotechnology: Biological Products (No Diagnostic Substances),SB
CLYM,Climb Bio Inc. Common Stock,207721418.0,United States,Health Care,Biotechnology: Pharmaceutical Preparations,SB
SLDB,Solid Biosciences Inc. Common Stock,206964864.0,United States,Health Care,Biotechnology: Biological Products (No Diagnostic Substances),SB
FFNW,First Financial Northwest Inc. Common Stock,206752224.0,United States,Finance,Banks,B
AMRN,Amarin Corporation plc,205710199.0,Ireland,Health Care,Biotechnology: Pharmaceutical Preparations,S
LNZA,LanzaTech Global Inc. Common Stock,205693337.0,United States,Industrials,Major Chemicals,SB
ALCO,Alico Inc. Common Stock,205329556.0,United States,,,SB
KINS,Kingstone Companies Inc. Common Stock,204995591.0,United States,Finance,Property-Casualty Insurers,SB
GNFT,GENFIT S.A. American Depositary Shares,204323430.0,France,Health Care,Biotechnology: Biological Products (No Diagnostic Substances),SB
ARAY,Accuray Incorporated Common Stock,204146982.0,United States,Health Care,Medical/Dental Instruments,SB
PVBC,Provident Bancorp Inc. (MD) Common Stock,203718194.0,United States,Finance,Banks,H
MITT,AG Mortgage Investment Trust Inc. Common Stock,203617627.0,United States,Real Estate,Real Estate Investment Trusts,SB
GTE,Gran Tierra Energy Inc. Common Stock,202644701.0,Canada,Energy,Oil & Gas Production,H
PROF,Profound Medical Corp. Common Stock,201240684.0,Canada,Health Care,Medical/Dental Instruments,SB
DC,Dakota Gold Corp. Common Stock,200192562.0,United States,Basic Materials,Metal Mining,SB
ADCT,ADC Therapeutics SA Common Shares,200147507.0,Switzerland,Health Care,Biotechnology: Pharmaceutical Preparations,SB
OBIO,Orchestra BioMed Holdings Inc. Ordinary Shares,199951147.0,United States,Health Care, Medicinal Chemicals and Botanical Products ,SB
TRVI,Trevi Therapeutics Inc. Common Stock,199850849.0,United States,Health Care,Biotechnology: Pharmaceutical Preparations,SB
KNOP,KNOT Offshore Partners LP Common Units representing Limited Partner Interests,199504175.0,United Kingdom,Consumer Discretionary,Marine Transportation,SB
CKPT,Checkpoint Therapeutics Inc. Common Stock,199236600.0,United States,Health Care,Biotechnology: Pharmaceutical Preparations,SB
PESI,Perma-Fix Environmental Services Inc. Common Stock,199115951.0,United States,Industrials,Environmental Services,SB
FCCO,First Community Corporation Common Stock,198962474.0,United States,Finance,Major Banks,B
HQI,HireQuest Inc. Common Stock (DE),198800000.0,United States,Consumer Discretionary,Professional Services,SB
ZVIA,Zevia PBC Class A Common Stock,198598300.0,United States,Consumer Staples,Beverages (Production/Distribution),B
NKSH,National Bankshares Inc. Common Stock,198271528.0,United States,Finance,Major Banks,SB
WNEB,Western New England Bancorp Inc. Common Stock,197888311.0,United States,Finance,Savings Institutions,H
CMCL,Caledonia Mining Corporation Plc Common Shares,197253390.0,Canada,Basic Materials,Precious Metals,SB
BRLT,Brilliant Earth Group Inc. Class A Common Stock,197103196.0,United States,Consumer Discretionary,Consumer Specialties,B
CHRS,Coherus BioSciences Inc. Common Stock,197014926.0,United States,Health Care,Biotechnology: Biological Products (No Diagnostic Substances),SB
BZFD,BuzzFeed Inc. Class A Common Stock,196845185.0,United States,Consumer Discretionary,Telecommunications Equipment,SB
SLDP,Solid Power Inc. Class A Common Stock,196622559.0,United States,Miscellaneous,Industrial Machinery/Components,H
BDSX,Biodesix Inc. Common Stock,196380848.0,United States,Health Care,Medical Specialities,SB
PEPG,PepGen Inc. Common Stock,195900379.0,United States,Health Care,Biotechnology: Pharmaceutical Preparations,SB
SEVN,Seven Hills Realty Trust Common Stock,195823462.0,United States,Real Estate,Real Estate Investment Trusts,SB
EARN,Ellington Credit Company Common Shares of Beneficial Interest,195554343.0,United States,Real Estate,Real Estate Investment Trusts,B
CRBP,Corbus Pharmaceuticals Holdings Inc. Common Stock,195480686.0,United States,Health Care,Biotechnology: Pharmaceutical Preparations,SB
BCOV,Brightcove Inc. Common Stock,195437377.0,United States,Technology,EDP Services,H
EMX,EMX Royalty Corporation Common Shares (Canada),195266951.0,Canada,Basic Materials,Metal Mining,SB
FSP,Franklin Street Properties Corp. Common Stock,194705424.0,United States,Real Estate,Real Estate Investment Trusts,H
MDWD,MediWound Ltd. Ordinary Shares,194543700.0,Israel,Health Care, Medicinal Chemicals and Botanical Products ,SB
BW,Babcock & Wilcox Enterprises Inc. Common Stock,194292270.0,United States,Industrials,Building Products,SB
CDLX,Cardlytics Inc. Common Stock,194141732.0,United States,Technology,Computer Software: Programming Data Processing,B
SWKH,SWK Holdings Corporation Common Stock,194018917.0,United States,Finance,Diversified Financial Services,SB
VUZI,Vuzix Corporation Common Stock,193608726.0,United States,Technology,Radio And Television Broadcasting And Communications Equipment,SB
GPRO,GoPro Inc. Class A Common Stock,193451331.0,United States,Consumer Discretionary,Industrial Machinery/Components,H
ELA,Envela Corporation Common Stock,192629226.0,United States,Consumer Discretionary,Consumer Specialties,SB
SPCE,Virgin Galactic Holdings Inc. Common Stock,192310797.0,United States,Consumer Discretionary,Transportation Services,H
RMNI,Rimini Street Inc. (DE) Common Stock,192295800.0,United States,Consumer Discretionary,Business Services,B
EPM,Evolution Petroleum Corporation Inc. Common Stock,192166500.0,United States,Energy,Oil & Gas Production,SB
NKTX,Nkarta Inc. Common Stock,191947011.0,United States,Health Care,Biotechnology: Pharmaceutical Preparations,SB
INFU,InfuSystems Holdings Inc. Common Stock,191797645.0,United States,Health Care,Medical/Dental Instruments,SB
SGHT,Sight Sciences Inc. Common Stock,190837356.0,United States,Health Care,Medical/Dental Instruments,B
PROP,Prairie Operating Co. Common Stock,190225733.0,United States,Finance,Finance: Consumer Services,B
GASS,StealthGas Inc. Common Stock,190108635.0,Greece,Consumer Discretionary,Marine Transportation,SB
MRBK,Meridian Corporation Common Stock,190069668.0,United States,Finance,Major Banks,B
RDCM,Radcom Ltd. Ordinary Shares,189815877.0,Israel,Technology,Computer peripheral equipment,SB
RAIL,FreightCar America Inc. Common Stock,189506539.0,United States,Industrials,Railroads,SB
FULC,Fulcrum Therapeutics Inc. Common Stock,189324700.0,United States,Health Care,Biotechnology: Pharmaceutical Preparations,B
CLLS,Cellectis S.A. American Depositary Shares,189170100.0,France,Health Care,Biotechnology: Pharmaceutical Preparations,SB
OKUR,OnKure Therapeutics Inc. Class A Common Stock,189152933.0,United States,Health Care,Biotechnology: Pharmaceutical Preparations,SB
KOPN,Kopin Corporation Common Stock,188972714.0,United States,Technology,Semiconductors,SB
DRUG,Bright Minds Biosciences Inc. Common Stock,188864943.0,Canada,Health Care,Biotechnology: Pharmaceutical Preparations,SB
TSVT,2seventy bio Inc. Common Stock ,188297733.0,United States,Health Care,Biotechnology: Pharmaceutical Preparations,B
NKTR,Nektar Therapeutics  Common Stock,188147450.0,United States,Health Care,Biotechnology: Pharmaceutical Preparations,B
TDUP,ThredUp Inc. Class A Common Stock,187700066.0,United States,Consumer Discretionary,Catalog/Specialty Distribution,SB
STXS,Stereotaxis Inc. Common Stock,187252210.0,United States,Health Care,Biotechnology: Electromedical & Electrotherapeutic Apparatus,SB
MRCC,Monroe Capital Corporation Common Stock,187197178.0,United States,Finance,Investment Managers,B
FLYX,flyExclusive Inc. Class A Common Stock,186729711.0,,Consumer Discretionary,Transportation Services,H
TSAT,Telesat Corporation Class A Common Shares and Class B Variable Voting Shares ,186392862.0,Canada,Industrials,Metal Fabrications,B
SRI,Stoneridge Inc. Common Stock,186340718.0,United States,Consumer Discretionary,Auto Parts:O.E.M.,SB
MVIS,MicroVision Inc. Common Stock,186165453.0,United States,Technology,Industrial Machinery/Components,H
SSP,E.W. Scripps Company (The) Class A Common Stock,185679381.0,United States,Industrials,Broadcasting,B
TIL,Instil Bio Inc. Common Stock,185335191.0,United States,Health Care,Biotechnology: Biological Products (No Diagnostic Substances),B
MRT,Marti Technologies Inc. Class A Ordinary Shares,184796945.0,,Consumer Discretionary,Rental/Leasing Companies,SB
FGBI,First Guaranty Bancshares Inc. Common Stock,184319529.0,United States,Finance,Savings Institutions,H
CRBU,Caribou Biosciences Inc. Common Stock,184274718.0,United States,Health Care,Biotechnology: Biological Products (No Diagnostic Substances),SB
INSG,Inseego Corp. Common Stock,184246918.0,United States,Telecommunications,Telecommunications Equipment,B
IKT,Inhibikase Therapeutics Inc. Common Stock,184107642.0,United States,Health Care,Biotechnology: Biological Products (No Diagnostic Substances),SB
FRGE,Forge Global Holdings Inc. Common Stock,184088358.0,United States,Finance,Investment Bankers/Brokers/Service,B
VSTA,Vasta Platform Limited Class A Ordinary Shares,183875073.0,Brazil,Real Estate,Other Consumer Services,H
VTYX,Ventyx Biosciences Inc. Common Stock,183847734.0,United States,Health Care,Biotechnology: Pharmaceutical Preparations,SB
TMQ,Trilogy Metals Inc. Common Stock,183429208.0,Canada,Basic Materials,Precious Metals,B
SMHI,SEACOR Marine Holdings Inc. Common Stock ,183288087.0,United States,Consumer Discretionary,Marine Transportation,SB
CCRD,CoreCard Corporation Common Stock,183069599.0,United States,Technology,Computer Software: Prepackaged Software,H
SKIN,The Beauty Health Company Class A Common Stock,182459572.0,United States,Health Care,Medical/Dental Instruments,H
RCMT,RCM Technologies Inc. Common Stock,182328672.0,United States,Consumer Discretionary,Professional Services,SB
ATOM,Atomera Incorporated Common Stock,182165550.0,United States,Technology,Semiconductors,SB
GLSI,Greenwich LifeSciences Inc. Common Stock,182053444.0,United States,Health Care,Biotechnology: Pharmaceutical Preparations,SB
III,Information Services Group Inc. Common Stock,181076842.0,United States,Consumer Discretionary,Professional Services,SB
KRMD,KORU Medical Systems Inc. Common Stock (DE),181057351.0,United States,Health Care,Medical/Dental Instruments,SB
ENTA,Enanta Pharmaceuticals Inc. Common Stock,180787601.0,United States,Health Care,Biotechnology: Pharmaceutical Preparations,B
AILE,iLearningEngines Inc. Common Stock,180701792.0,United States,Technology,Computer Software: Prepackaged Software,SB
ALLT,Allot Ltd. Ordinary Shares,180371613.0,Israel,Telecommunications,Computer Communications Equipment,SB
OXSQ,Oxford Square Capital Corp. Common Stock,179914280.0,United States,Finance,Blank Checks,H
HNVR,Hanover Bancorp Inc. Common Stock,179887915.0,United States,Finance,Major Banks,SB
ORGN,Origin Materials Inc. Common Stock,179887705.0,United States,Industrials,Major Chemicals,SB
ADAP,Adaptimmune Therapeutics plc American Depositary Shares,179118245.0,United Kingdom,Health Care,Biotechnology: Biological Products (No Diagnostic Substances),B
TRVG,trivago N.V. American Depositary Shares,179075629.0,Germany,Technology,EDP Services,H
ZURA,Zura Bio Limited Class A Ordinary Shares,178904272.0,Cayman Islands,Health Care,Biotechnology: Biological Products (No Diagnostic Substances),SB
PROC,Procaps Group S.A. Ordinary Shares,178262209.0,Luxembourg,Health Care,Biotechnology: Pharmaceutical Preparations,H
IDR,Idaho Strategic Resources Inc. Common Stock,178004641.0,,Basic Materials,Precious Metals,SB
GGR,Gogoro Inc. Ordinary Shares,177720661.0,Taiwan,Consumer Discretionary,Auto Manufacturing,H
PAYS,Paysign Inc. Common Stock,177245118.0,United States,Consumer Discretionary,Business Services,SB
AVD,American Vanguard Corporation Common Stock ($0.10 Par Value),177045148.0,United States,Industrials,Agricultural Chemicals,SB
QSI,Quantum-Si Incorporated Class A Common Stock,176963936.0,United States,Industrials,Industrial Machinery/Components,B
JRVR,James River Group Holdings Ltd. Common Shares,175907059.0,Bermuda,Finance,Property-Casualty Insurers,B
CLAR,Clarus Corporation Common Stock,175315080.0,United States,Consumer Discretionary,Recreational Games/Products/Toys,SB
JYNT,The Joint Corp. Common Stock,175308225.0,United States,Miscellaneous,Multi-Sector Companies,SB
CBNA,Chain Bridge Bancorp Inc. Class A Common Stock,175003659.0,,Finance,Major Banks,SB
BWAY,BrainsWay Ltd. American Depositary Shares,173675777.0,Israel,Health Care,Medical/Dental Instruments,SB
SCPH,scPharmaceuticals Inc. Common Stock,173138864.0,United States,Health Care,Biotechnology: Pharmaceutical Preparations,SB
INZY,Inozyme Pharma Inc. Common Stock,172806133.0,United States,Health Care,Biotechnology: Pharmaceutical Preparations,SB
CABA,Cabaletta Bio Inc. Common Stock,171558846.0,United States,Health Care,Biotechnology: Biological Products (No Diagnostic Substances),SB
GNSS,Genasys Inc. Common Stock,171279414.0,United States,Consumer Staples,Consumer Electronics/Appliances,SB
LAKE,Lakeland Industries Inc. Common Stock,170713620.0,United States,Health Care,Industrial Specialties,SB
AMTX,Aemetis Inc. (DE) Common Stock,170589582.0,United States,Industrials,Major Chemicals,B
BFIN,BankFinancial Corporation Common Stock,170462075.0,United States,Finance,Savings Institutions,B
CZWI,Citizens Community Bancorp Inc. Common Stock,169372063.0,United States,Finance,Savings Institutions,SB
MX,Magnachip Semiconductor Corporation Common Stock,169272663.0,Luxembourg,Technology,Semiconductors,B
CBFV,CB Financial Services Inc. Common Stock,168720840.0,United States,Finance,Major Banks,H
