Symbol,Name,Market Cap,Country,Sector,Industry,Move
WGO,Winnebago Industries Inc. Common Stock,1637058340.0,United States,Industrials,Homebuilding,SB
MXL,MaxLinear Inc. Common Stock,1629869551.0,United States,Technology,Semiconductors,B
INMD,InMode Ltd. Ordinary Shares,1629259763.0,Israel,Health Care,Biotechnology: Electromedical & Electrotherapeutic Apparatus,B
RLJ,RLJ Lodging Trust Common Shares of Beneficial Interest $0.01 par value,1625063602.0,United States,Real Estate,Real Estate Investment Trusts,B
NAPA,The Duckhorn Portfolio Inc. Common Stock,1623230755.0,United States,Consumer Staples,Beverages (Production/Distribution),B
EVO,Evotec SE American Depositary Shares,1623021342.0,Germany,Health Care,Biotechnology: Pharmaceutical Preparations,B
SDGR,Schrodinger Inc. Common Stock,1619650390.0,United States,Health Care,Biotechnology: Pharmaceutical Preparations,SB
MMI,Marcus & Millichap Inc. Common Stock,1615842560.0,United States,Finance,Real Estate,SS
HLX,Helix Energy Solutions Group Inc. Common Stock,1615339191.0,United States,Energy,Oilfield Services/Equipment,SB
VRNT,Verint Systems Inc. Common Stock,1610283796.0,United States,Technology,EDP Services,B
DNOW,DNOW Inc. Common Stock,1605686171.0,United States,Industrials,Metal Fabrications,SB
MAG,MAG Silver Corporation Ordinary Shares,1603380137.0,Canada,Basic Materials,Precious Metals,SB
TCBK,TriCo Bancshares Common Stock,1602411199.0,United States,Finance,Major Banks,B
ANDE,Andersons Inc. (The) Common Stock,1599586641.0,United States,Industrials,Farming/Seeds/Milling,SB
MCRI,Monarch Casino & Resort Inc. Common Stock,1599204342.0,United States,Consumer Discretionary,Hotels/Resorts,H
CSGS,CSG Systems International Inc. Common Stock,1598641722.0,United States,Technology,EDP Services,SB
XMTR,Xometry Inc. Class A Common Stock,1595968303.0,United States,Consumer Discretionary,Business Services,B
SRCE,1st Source Corporation Common Stock,1594049371.0,United States,Finance,Major Banks,H
ORLA,Orla Mining Ltd. Common Shares,1588464254.0,,Basic Materials,Precious Metals,SB
PLAB,Photronics Inc. Common Stock,1584477588.0,United States,Technology,Semiconductors,SB
VRDN,Viridian Therapeutics Inc. Common Stock,1581086430.0,United States,Health Care,Medical Specialities,SB
NMRA,Neumora Therapeutics Inc. Common Stock,1578451595.0,United States,Health Care,Biotechnology: Biological Products (No Diagnostic Substances),SB
KW,Kennedy-Wilson Holdings Inc. Common Stock,1577488876.0,United States,Finance,Real Estate,H
WOOF,Petco Health and Wellness Company Inc. Class A Common Stock,1576349435.0,United States,Consumer Discretionary,Other Specialty Stores,B
MNR,Mach Natural Resources LP Common Units representing Limited Partner Interests,1576160056.0,,Energy,Oil & Gas Production,SB
INFN,Infinera Corporation Common Stock,1572367438.0,United States,Utilities,Telecommunications Equipment,H
SPNS,Sapiens International Corporation N.V. Common Shares (Cayman Islands),1572234531.0,Curacao,Technology,Computer Software: Prepackaged Software,B
VET,Vermilion Energy Inc. Common (Canada),1571427000.0,Canada,Energy,Oil & Gas Production,SB
DAC,Danaos Corporation Common Stock,1568059702.0,Greece,Consumer Discretionary,Marine Transportation,B
GRDN,Guardian Pharmacy Services Inc. Class A Common Stock,1567798127.0,,Consumer Staples,Retail-Drug Stores and Proprietary Stores,SB
PZZA,Papa John's International Inc. Common Stock,1567450736.0,United States,Consumer Discretionary,Restaurants,B
OPEN,Opendoor Technologies Inc Common Stock,1566002755.0,United States,Finance,Real Estate,B
RCUS,Arcus Biosciences Inc. Common Stock,1564848514.0,United States,Health Care,Biotechnology: Pharmaceutical Preparations,SB
DHT,DHT Holdings Inc.,1563305553.0,Jersey,Consumer Discretionary,Marine Transportation,SB
CMRE,Costamare Inc. Common Stock $0.0001 par value,1561361277.0,Greece,Consumer Discretionary,Marine Transportation,H
SILV,SilverCrest Metals Inc. Common Shares,1559815425.0,Canada,Basic Materials,Precious Metals,B
SCS,Steelcase Inc. Common Stock,1553411359.0,United States,Consumer Discretionary,Office Equipment/Supplies/Services,SB
PX,P10 Inc. Class A Common Stock,1551556295.0,United States,Finance,Investment Managers,B
UMH,UMH Properties Inc. Common Stock,1548802858.0,United States,Real Estate,Real Estate Investment Trusts,SB
FSM,Fortuna Mining Corp. Common Shares,1547854295.0,Canada,Basic Materials,Precious Metals,B
SVV,Savers Value Village Inc. Common Stock,1543122603.0,United States,Consumer Discretionary,Other Specialty Stores,SB
TILE,Interface Inc. Common Stock,1541546417.0,United States,Consumer Discretionary,Home Furnishings,SB
ARIS,Aris Water Solutions Inc. Class A Common Stock,1541252782.0,United States,Energy,Oilfield Services/Equipment,SB
XPRO,Expro Group Holdings N.V. Common Stock,1540360630.0,United States,Energy,Oilfield Services/Equipment,SB
QCRH,QCR Holdings Inc. Common Stock,1536928303.0,United States,Finance,Major Banks,SB
BUSE,First Busey Corporation Class A Common Stock,1533998473.0,United States,Finance,Major Banks,B
MTTR,Matterport Inc. Class A Common Stock,1533752813.0,United States,Technology,Computer Software: Prepackaged Software,H
ARHS,Arhaus Inc. Class A Common Stock,1531773795.0,United States,Consumer Discretionary,Other Specialty Stores,SB
ERO,Ero Copper Corp. Common Shares,1530939636.0,Canada,Basic Materials,Metal Mining,SB
SFL,SFL Corporation Ltd,1529955000.0,Bermuda,Consumer Discretionary,Marine Transportation,SB
IMCR,Immunocore Holdings plc American Depositary Shares,1526804986.0,United Kingdom,Health Care,Biotechnology: Biological Products (No Diagnostic Substances),SB
KNSA,Kiniksa Pharmaceuticals International plc Class A Ordinary Shares,1525619068.0,United States,Health Care,Biotechnology: Pharmaceutical Preparations,SB
BB,BlackBerry Limited Common Stock,1522646763.0,Canada,Technology,Computer Software: Prepackaged Software,B
MODG,Topgolf Callaway Brands Corp. Common Stock,1522062190.0,United States,Consumer Discretionary,Recreational Games/Products/Toys,B
ALGT,Allegiant Travel Company Common Stock,1520713123.0,United States,Consumer Discretionary,Air Freight/Delivery Services,B
KRNT,Kornit Digital Ltd. Ordinary Shares,1519870311.0,Israel,Industrials,Industrial Machinery/Components,SB
GSBD,Goldman Sachs BDC Inc. Common Stock,1518999025.0,United States,Finance,Investment Managers,H
BCRX,BioCryst Pharmaceuticals Inc. Common Stock,1518281745.0,United States,Health Care,Biotechnology: Biological Products (No Diagnostic Substances),SB
SAFE,Safehold Inc. New Common Stock ,1516590101.0,United States,Real Estate,Real Estate Investment Trusts,SB
KRP,Kimbell Royalty Partners Common Units Representing Limited Partner Interests,1516441083.0,United States,Energy,Oil & Gas Production,SB
DCBO,Docebo Inc. Common Shares,1512150969.0,Canada,Technology,Computer Software: Prepackaged Software,SB
ZUO,Zuora Inc. Class A Common Stock,1511970000.0,United States,Technology,Computer Software: Prepackaged Software,B
TVTX,Travere Therapeutics Inc. Common Stock,1511827105.0,United States,Health Care,Biotechnology: Pharmaceutical Preparations,SB
HLIT,Harmonic Inc. Common Stock,1511370910.0,United States,Technology,Radio And Television Broadcasting And Communications Equipment,SB
MYGN,Myriad Genetics Inc. Common Stock,1511184818.0,United States,Health Care,Biotechnology: In Vitro & In Vivo Diagnostic Substances,B
USPH,U.S. Physical Therapy Inc. Common Stock,1508140151.0,United States,Health Care,Medical/Nursing Services,SB
LADR,Ladder Capital Corp Class A Common Stock,1501022657.0,United States,Real Estate,Real Estate Investment Trusts,SB
VITL,Vital Farms Inc. Common Stock,1498919617.0,United States,Consumer Staples,Packaged Foods,SB
NSSC,NAPCO Security Technologies Inc. Common Stock,1496709974.0,United States,Telecommunications,Telecommunications Equipment,SB
TGI,Triumph Group Inc. Common Stock,1494408376.0,United States,Industrials,Aerospace,B
OCUL,Ocular Therapeutix Inc. Common Stock,1490421208.0,United States,Health Care,Biotechnology: Pharmaceutical Preparations,SB
FOR,Forestar Group Inc Common Stock ,1484122718.0,United States,Finance,Real Estate,SB
SABR,Sabre Corporation Common Stock,1481679310.0,United States,Technology,Computer Software: Programming Data Processing,H
RBCAA,Republic Bancorp Inc. Class A Common Stock,1478467063.0,United States,Finance,Major Banks,H
ARQT,Arcutis Biotherapeutics Inc. Common Stock,1475932293.0,United States,Health Care,Biotechnology: Pharmaceutical Preparations,SB
NTLA,Intellia Therapeutics Inc. Common Stock,1475785808.0,United States,Health Care,Biotechnology: In Vitro & In Vivo Diagnostic Substances,SB
NRIX,Nurix Therapeutics Inc. Common stock,1474811391.0,United States,Health Care,Biotechnology: Pharmaceutical Preparations,SB
ADEA,Adeia Inc. Common Stock,1473984000.0,United States,Technology,Computer Software: Prepackaged Software,SB
INDV,Indivior PLC Ordinary Shares,1471974329.0,United Kingdom,Health Care,Biotechnology: Pharmaceutical Preparations,SB
PLAY,Dave & Buster's Entertainment Inc. Common Stock,1471047172.0,United States,Consumer Discretionary,Restaurants,SB
NMM,Navios Maritime Partners LP Common Units Representing Limited Partner Interests,1469074164.0,Greece,Consumer Discretionary,Marine Transportation,SB
UNFI,United Natural Foods Inc. Common Stock,1467831385.0,United States,Consumer Discretionary,Food Distributors,H
UNIT,Uniti Group Inc. Common Stock,1464687264.0,United States,Real Estate,Real Estate Investment Trusts,B
SEI,Solaris Energy Infrastructure Inc. Class A Common Stock,1464517075.0,United States,Industrials,Metal Fabrications,SB
WINA,Winmark Corporation Common Stock,1460896422.0,United States,Consumer Discretionary,Other Specialty Stores,SB
AMRC,Ameresco Inc. Class A Common Stock,1460006188.0,United States,Consumer Discretionary,Engineering & Construction,SB
ASAI,Sendas Distribuidora S A ADS,1459979856.0,,Consumer Staples,Food Chains,B
ELME,Elme Communities Common Stock,1457450204.0,United States,Real Estate,Real Estate Investment Trusts,B
AFYA,Afya Limited Class A Common Shares,1455380532.0,Brazil,Real Estate,Other Consumer Services,H
ATSG,Air Transport Services Group Inc,1455266676.0,United States,Consumer Discretionary,Air Freight/Delivery Services,H
SNDX,Syndax Pharmaceuticals Inc. Common Stock,1444251861.0,United States,Health Care,Biotechnology: Pharmaceutical Preparations,SB
SYRE,Spyre Therapeutics Inc. Common Stock,1439559848.0,United States,Health Care,Biotechnology: Pharmaceutical Preparations,SB
PBI,Pitney Bowes Inc. Common Stock,1435436486.0,United States,Miscellaneous,Office Equipment/Supplies/Services,H
GDYN,Grid Dynamics Holdings Inc. Class A Common Stock,1433293129.0,United States,Technology,Computer Software: Prepackaged Software,SB
DCOM,Dime Community Bancshares Inc. Common Stock,1432511819.0,United States,Finance,Major Banks,SB
AOSL,Alpha and Omega Semiconductor Limited Common Shares,1427155996.0,Bermuda,Technology,Semiconductors,B
CDRE,Cadre Holdings Inc. Common Stock,1426964698.0,United States,Health Care,Industrial Specialties,SB
AMPL,Amplitude Inc. Class A Common Stock,1426225533.0,United States,Technology,Computer Software: Prepackaged Software,B
ATEC,Alphatec Holdings Inc. Common Stock,1424767094.0,United States,Health Care,Medical/Dental Instruments,SB
ALEX,Alexander & Baldwin Inc. Common Stock REIT Holding Company,1420700443.0,United States,Real Estate,Real Estate Investment Trusts,SB
TPC,Tutor Perini Corporation Common Stock,1419934465.0,United States,Consumer Discretionary,General Bldg Contractors - Nonresidential Bldgs,SB
CMPO,CompoSecure Inc. Class A Common Stock,1417146609.0,United States,Finance,Finance: Consumer Services,SB
LZ,LegalZoom.com Inc. Common Stock,1417142122.0,United States,Technology,EDP Services,H
LNN,Lindsay Corporation Common Stock,1417092873.0,United States,Industrials,Industrial Machinery/Components,B
SPHR,Sphere Entertainment Co. Class A Common Stock,1416697270.0,United States,Consumer Discretionary,Services-Misc. Amusement & Recreation,B
SGML,Sigma Lithium Corporation Common Shares,1415733061.0,Canada,Basic Materials,Metal Mining,SB
LOMA,Loma Negra Compania Industrial Argentina Sociedad Anonima ADS,1414363156.0,Argentina,Industrials,Building Materials,H
SBH,Sally Beauty Holdings Inc. (Name to be changed from Sally Holdings Inc.) Common Stock,1413088985.0,United States,Consumer Discretionary,Other Specialty Stores,B
MDXG,MiMedx Group Inc Common Stock,1409214183.0,United States,Health Care,Biotechnology: Pharmaceutical Preparations,SB
DOLE,Dole plc Ordinary Shares,1406850433.0,Ireland,Consumer Staples,Farming/Seeds/Milling,B
SILA,Sila Realty Trust Inc. Common Stock,1405721193.0,United States,Real Estate,Real Estate Investment Trusts,SB
SPRY,ARS Pharmaceuticals Inc. Common Stock,1401414550.0,United States,Health Care,Biotechnology: Pharmaceutical Preparations,SB
MRTN,Marten Transport Ltd. Common Stock,1400088335.0,United States,Industrials,Trucking Freight/Courier Services,B
NX,Quanex Building Products Corporation Common Stock,1397716231.0,United States,Industrials,Metal Fabrications,SB
GEL,Genesis Energy L.P. Common Units,1394868582.0,United States,Energy,Oil Refining/Marketing,B
DAWN,Day One Biopharmaceuticals Inc. Common Stock,1391678857.0,United States,Health Care,Biotechnology: Pharmaceutical Preparations,SB
GIII,G-III Apparel Group LTD. Common Stock,1391578890.0,United States,Consumer Discretionary,Apparel,H
CDNA,CareDx Inc. Common Stock,1390189936.0,United States,Health Care,Medical Specialities,B
AMSC,American Superconductor Corporation Common Stock,1389936764.0,United States,Consumer Discretionary,Metal Fabrications,SB
BY,Byline Bancorp Inc. Common Stock,1387481477.0,United States,Finance,Major Banks,B
PRAX,Praxis Precision Medicines Inc. Common Stock,1382923053.0,United States,Health Care,Biotechnology: Pharmaceutical Preparations,SB
NVEE,NV5 Global Inc. Common Stock,1380767321.0,United States,Consumer Discretionary,Other Consumer Services,SB
TNK,Teekay Tankers Ltd.,1378725288.0,Bermuda,Consumer Discretionary,Marine Transportation,SB
JKS,JinkoSolar Holding Company Limited American Depositary Shares (each representing 4 Common Shares),1377766358.0,China,Technology,Semiconductors,H
FSLY,Fastly Inc. Class A Common Stock,1376343000.0,United States,Technology,Computer Software: Prepackaged Software,B
JBGS,JBG SMITH Properties Common Shares ,1376142694.0,United States,Real Estate,Real Estate Investment Trusts,S
KARO,Karooooo Ltd. Ordinary Shares,1370724000.0,Singapore,Technology,Computer Software: Prepackaged Software,SB
FVRR,Fiverr International Ltd. Ordinary Shares no par value,1370282811.0,,Consumer Discretionary,Business Services,B
MRVI,Maravai LifeSciences Holdings Inc. Class A Common Stock,1367436873.0,United States,Health Care,Biotechnology: Pharmaceutical Preparations,SB
ROOT,Root Inc. Class A Common Stock,1365795000.0,United States,Finance,Property-Casualty Insurers,B
OLPX,Olaplex Holdings Inc. Common Stock,1365620970.0,United States,Consumer Discretionary,Package Goods/Cosmetics,H
RES,RPC Inc. Common Stock,1365074429.0,United States,Energy,Oilfield Services/Equipment,H
HTZ,Hertz Global Holdings Inc Common Stock,1361702219.0,United States,Consumer Discretionary,Rental/Leasing Companies,H
BCYC,Bicycle Therapeutics plc American Depositary Shares,1358825693.0,United Kingdom,Health Care,Biotechnology: Pharmaceutical Preparations,SB
PFBC,Preferred Bank Common Stock,1357714065.0,United States,Finance,Major Banks,SB
HROW,Harrow Inc. Common Stock,1356208461.0,United States,Health Care,Biotechnology: Pharmaceutical Preparations,SB
HDL,SUPER HI INTERNATIONAL HOLDING LTD. American Depositary Shares,1355873415.0,Singapore,Consumer Discretionary,Restaurants,SB
ULCC,Frontier Group Holdings Inc. Common Stock,1354487589.0,United States,Consumer Discretionary,Air Freight/Delivery Services,H
IMAX,Imax Corporation Common Stock,1350782915.0,Canada,Consumer Discretionary,Industrial Machinery/Components,SB
GABC,German American Bancorp Inc. Common Stock,1348876872.0,United States,Finance,Major Banks,B
OCSL,Oaktree Specialty Lending Corporation Common Stock,1346355872.0,United States,Finance,Finance: Consumer Services,B
LILA,Liberty Latin America Ltd. Class A Common Stock,1345428000.0,United States,Telecommunications,Cable & Other Pay Television Services,B
EVH,Evolent Health Inc Class A Common Stock,1341650604.0,United States,Consumer Discretionary,Other Consumer Services,SB
TASK,TaskUs Inc. Class A Common Stock,1340506476.0,United States,Technology,EDP Services,B
LILAK,Liberty Latin America Ltd. Class C Common Stock,1339527000.0,United States,Telecommunications,Cable & Other Pay Television Services,B
ACDC,ProFrac Holding Corp. Class A Common Stock,1338825593.0,United States,Energy,Oilfield Services/Equipment,B
CTOS,Custom Truck One Source Inc. Common Stock,1337568036.0,Cayman Islands,Consumer Discretionary,Diversified Commercial Services,SB
UTI,Universal Technical Institute Inc Common Stock,1335609298.0,United States,Real Estate,Other Consumer Services,SB
TBLA,Taboola.com Ltd. Ordinary Shares,1334746582.0,Israel,Technology,Computer Software: Programming Data Processing,SB
BLBD,Blue Bird Corporation Common Stock,1331055908.0,United States,Consumer Discretionary,Construction/Ag Equipment/Trucks,SB
BLND,Blend Labs Inc. Class A Common Stock,1330836354.0,United States,Technology,Computer Software: Programming Data Processing,SB
MFIC,MidCap Financial Investment Corporation Common Stock,1330742145.0,United States,Finance,Finance/Investors Services,B
AMWD,American Woodmark Corporation Common Stock,1329885643.0,United States,Basic Materials,Forest Products,SB
ATEN,A10 Networks Inc. Common Stock,1329856160.0,United States,Telecommunications,Computer Communications Equipment,B
NVAX,Novavax Inc. Common Stock,1329535450.0,United States,Health Care,Biotechnology: Biological Products (No Diagnostic Substances),B
KALU,Kaiser Aluminum Corporation Common Stock,1329351853.0,United States,Industrials,Metal Fabrications,H
COUR,Coursera Inc. Common Stock,1327390441.0,United States,Technology,Computer Software: Prepackaged Software,SB
CNNE,Cannae Holdings Inc. Common Stock,1326316497.0,United States,Consumer Discretionary,Restaurants,SB
INOD,Innodata Inc. Common Stock,1324154794.0,United States,Technology,EDP Services,SB
ARDX,Ardelyx Inc. Common Stock,1321646827.0,United States,Health Care,Biotechnology: Pharmaceutical Preparations,SB
FOXF,Fox Factory Holding Corp. Common Stock,1318028982.0,United States,Consumer Discretionary,Motor Vehicles,B
BHLB,Berkshire Hills Bancorp Inc. Common Stock,1317199504.0,United States,Finance,Banks,B
EIG,Employers Holdings Inc Common Stock,1315638216.0,United States,Finance,Property-Casualty Insurers,B
DQ,DAQO New Energy Corp. American Depositary Shares each representing five ordinary shares,1310247902.0,China,Technology,Semiconductors,SB
CRAI,CRA International Inc. Common Stock,1309500987.0,United States,Consumer Discretionary,Other Consumer Services,B
MESO,Mesoblast Limited American Depositary Shares,1307342806.0,Australia,Health Care,Biotechnology: Biological Products (No Diagnostic Substances),SB
IRS,IRSA Inversiones Y Representaciones S.A. Global Depositary Shares (Each representing ten shares of Common Stock),1306159022.0,Argentina,Real Estate,Homebuilding,SB
ARLO,Arlo Technologies Inc. Common Stock,1304437888.0,United States,Consumer Staples,Consumer Electronics/Appliances,SB
AHCO,AdaptHealth Corp. Common Stock,1303836874.0,United States,Health Care,Medical/Nursing Services,SB
CARS,Cars.com Inc. Common Stock ,1301259387.0,United States,Technology,EDP Services,SB
ENFN,Enfusion Inc. Class A Common Stock,1299851172.0,United States,Technology,Computer Software: Prepackaged Software,B
THRM,Gentherm Inc Common Stock,1298052237.0,United States,Consumer Discretionary,Auto Parts:O.E.M.,SB
CGAU,Centerra Gold Inc. Common Shares,1291233357.0,Canada,Basic Materials,Precious Metals,SB
NTST,NetSTREIT Corp. Common Stock,1283315014.0,United States,Real Estate,Real Estate Investment Trusts,SB
WOLF,Wolfspeed Inc. Common Stock,1280964449.0,United States,Technology,Semiconductors,B
NMFC,New Mountain Finance Corporation Common Stock,1279117782.0,United States,Finance,Finance/Investors Services,B
MD,Pediatrix Medical Group Inc. Common Stock,1278760451.0,United States,Health Care,Hospital/Nursing Management,B
STAA,STAAR Surgical Company Common Stock,1278708956.0,United States,Health Care,Ophthalmic Goods,B
SAFT,Safety Insurance Group Inc. Common Stock,1277404023.0,United States,Finance,Property-Casualty Insurers,H
OXM,Oxford Industries Inc. Common Stock,1275869962.0,United States,Consumer Discretionary,Apparel,H
ULH,Universal Logistics Holdings Inc. Common Stock,1274044553.0,United States,Industrials,Trucking Freight/Courier Services,H
PGNY,Progyny Inc. Common Stock,1267080613.0,United States,Health Care,Misc Health and Biotechnology Services,B
XPEL,XPEL Inc. Common Stock,1266538388.0,United States,Industrials,Industrial Specialties,SB
SCSC,ScanSource Inc. Common Stock,1266269394.0,United States,Technology,Retail: Computer Software & Peripheral Equipment,H
DSP,Viant Technology Inc. Class A Common Stock,1263950161.0,United States,Technology,Computer Software: Programming Data Processing,SB
QNST,QuinStreet Inc. Common Stock,1263666306.0,United States,Consumer Discretionary,Business Services,SB
FLNG,FLEX LNG Ltd. Ordinary Shares,1262016800.0,,Consumer Discretionary,Marine Transportation,H
ARI,Apollo Commercial Real Estate Finance Inc,1258770934.0,United States,Real Estate,Real Estate Investment Trusts,H
DEA,Easterly Government Properties Inc. Common Stock,1256402983.0,United States,Real Estate,Real Estate Investment Trusts,H
LEU,Centrus Energy Corp. Class A Common Stock,1255146257.0,United States,Industrials,Mining & Quarrying of Nonmetallic Minerals (No Fuels),SB
PEBO,Peoples Bancorp Inc. Common Stock,1254499484.0,United States,Finance,Major Banks,B
COHU,Cohu Inc. Common Stock,1249248125.0,United States,Industrials,Electrical Products,B
MOMO,Hello Group Inc. American Depositary Shares,1249033689.0,China,Technology,Computer Software: Prepackaged Software,B
AUPH,Aurinia Pharmaceuticals Inc Ordinary Shares,1246881293.0,Canada,Health Care,Biotechnology: Pharmaceutical Preparations,SB
UDMY,Udemy Inc. Common Stock,1245998101.0,United States,Real Estate,Other Consumer Services,SB
SA,Seabridge Gold Inc. Ordinary Shares (Canada),1245653569.0,Canada,Basic Materials,Precious Metals,SB
SPH,Suburban Propane Partners L.P. Common Stock,1244658853.0,United States,Consumer Discretionary,Other Specialty Stores,H
HG,Hamilton Insurance Group Ltd. Class B Common Shares,1244137356.0,Bermuda,,,SB
AORT,Artivion Inc. Common Stock,1242924916.0,United States,Health Care,Medical/Dental Instruments,SB
PLYA,Playa Hotels & Resorts N.V. Ordinary Shares,1239857093.0,Netherlands,Consumer Discretionary,Hotels/Resorts,SB
HCI,HCI Group Inc. Common Stock,1239497423.0,United States,Finance,Property-Casualty Insurers,SB
RCKT,Rocket Pharmaceuticals Inc. Common Stock,1237913214.0,United States,Health Care,Biotechnology: Pharmaceutical Preparations,SB
ESTA,Establishment Labs Holdings Inc. Common Shares,1236666492.0,Costa Rica,Health Care,Industrial Specialties,SB
AIV,Apartment Investment and Management Company Common Stock,1236106970.0,United States,Real Estate,Real Estate Investment Trusts,B
PDFS,PDF Solutions Inc. Common Stock,1235691176.0,United States,Technology,Computer Software: Prepackaged Software,SB
CRCT,Cricut Inc. Class A Common Stock,1224494517.0,United States,Technology,Industrial Machinery/Components,H
PL,Planet Labs PBC Class A Common Stock,1223796601.0,United States,Technology,Radio And Television Broadcasting And Communications Equipment,SB
BLFS,BioLife Solutions Inc. Common Stock,1223694705.0,United States,Health Care,Biotechnology: Electromedical & Electrotherapeutic Apparatus,SB
UPB,Upstream Bio Inc. Common Stock,1223074435.0,United States,Health Care,Biotechnology: Pharmaceutical Preparations,SB
PHR,Phreesia Inc. Common Stock,1222482499.0,United States,Consumer Discretionary,Business Services,SB
EVEX,Eve Holding Inc. Common Stock,1217365179.0,,Industrials,Aerospace,SB
SSRM,SSR Mining Inc. Common Stock,1216618420.0,Canada,Industrials,Precious Metals,B
TWO,Two Harbors Investment Corp,1215815978.0,United States,Real Estate,Real Estate Investment Trusts,SB
CBRL,Cracker Barrel Old Country Store Inc Common Stock,1215241996.0,United States,Consumer Discretionary,Restaurants,H
PSFE,Paysafe Limited Common Shares,1210935472.0,,Consumer Discretionary,Business Services,H
HSAI,Hesai Group American Depositary Share each ADS represents one Class B ordinary share,1210581500.0,China,Industrials,Industrial Machinery/Components,SB
RC,Ready Capital Corporation Common Stock,1210050455.0,United States,Real Estate,Real Estate Investment Trusts,B
GETY,Getty Images Holdings Inc. Class A Common Stock,1208560024.0,United States,Consumer Discretionary,Business Services,SB
DGII,Digi International Inc. Common Stock,1205406423.0,United States,Telecommunications,Computer Communications Equipment,SB
DESP,Despegar.com Corp. Ordinary Shares,1203305290.0,Argentina,Consumer Discretionary,Transportation Services,B
PRO,PROS Holdings Inc. Common Stock,1201571511.0,United States,Technology,EDP Services,SB
NG,Novagold Resources Inc.,1200606260.0,Canada,Basic Materials,Precious Metals,B
MRC,MRC Global Inc. Common Stock,1200221468.0,United States,Industrials,Industrial Machinery/Components,SB
OLO,Olo Inc. Class A Common Stock,1199699114.0,United States,Technology,Computer Software: Prepackaged Software,B
BOW,Bowhead Specialty Holdings Inc. Common Stock,1198578804.0,,Finance,Property-Casualty Insurers,B
OCFC,OceanFirst Financial Corp. Common Stock,1196762461.0,United States,Finance,Major Banks,B
DK,Delek US Holdings Inc. Common Stock,1196284473.0,United States,Energy,Integrated oil Companies,H
ANIP,ANI Pharmaceuticals Inc.,1195769723.0,United States,Health Care,Biotechnology: Pharmaceutical Preparations,SB
