Symbol,Name,Market Cap,Country,Sector,Industry
GRO,Brazil Potash Corp. Common Shares,531702368.0,,Industrials,Mining & Quarrying of Nonmetallic Minerals (No Fuels)
AUNA,Auna SA Class A Ordinary Shares,531467379.0,Peru,Health Care,Medical/Nursing Services
EGY,VAALCO Energy Inc.  Common Stock,531164995.0,United States,Energy,Oil & Gas Production
TMCI,Treace Medical Concepts Inc. Common Stock,530771105.0,United States,Health Care,Medical/Dental Instruments
TERN,Terns Pharmaceuticals Inc. Common Stock,530018455.0,United States,Health Care,Biotechnology: Pharmaceutical Preparations
MGTX,MeiraGTx Holdings plc Ordinary Shares,529098525.0,United States,Health Care,Biotechnology: Biological Products (No Diagnostic Substances)
BGS,B&G Foods Inc. Common Stock,528814758.0,United States,Consumer Staples,Packaged Foods
CHPT,ChargePoint Holdings Inc. Common Stock,526528303.0,United States,Consumer Discretionary,Industrial Specialties
LASR,nLIGHT Inc. Common Stock,525942806.0,United States,Technology,Semiconductors
MGRD,Affiliated Managers Group Inc. 4.200% Junior Subordinated Notes due 2061,525917297.0,United States,Finance,Investment Managers
CCNEP,CNB Financial Corporation Depositary Shares each representing a 1/40th ownership interest in a share of 7.125% Series A Fixed-Rate Non-Cumulative Perpetual Preferred Stock,523688296.0,United States,Finance,Major Banks
PACB,Pacific Biosciences of California Inc. Common Stock,523079369.0,United States,Industrials,Biotechnology: Laboratory Analytical Instruments
KELYA,Kelly Services Inc. Class A Common Stock,521684039.0,United States,Consumer Discretionary,Professional Services
GLRE,Greenlight Capital Re Ltd. Class A Ordinary Shares,520049120.0,Cayman Islands,Finance,Property-Casualty Insurers
ALLO,Allogene Therapeutics Inc. Common Stock,519986786.0,United States,Health Care,Biotechnology: Biological Products (No Diagnostic Substances)
HNRG,Hallador Energy Company Common Stock,519928718.0,United States,Energy,Coal Mining
SIGA,SIGA Technologies Inc. Common Stock,519825990.0,United States,Health Care,Biotechnology: Pharmaceutical Preparations
KELYB,Kelly Services Inc. Class B Common Stock,519547449.0,United States,Consumer Discretionary,Professional Services
FLWS,1-800-FLOWERS.COM Inc. Common Stock,519108207.0,United States,Consumer Discretionary,Other Specialty Stores
GCBC,Greene County Bancorp Inc. Common Stock,517956108.0,United States,Finance,Banks
SLSR,Solaris Resources Inc. Common Shares,517556424.0,,,
LINC,Lincoln Educational Services Corporation Common Stock,517202714.0,United States,Real Estate,Other Consumer Services
FFIC,Flushing Financial Corporation Common Stock,515682339.0,United States,Finance,Major Banks
YORW,York Water Company (The) Common Stock,515170002.0,United States,Utilities,Water Supply
NVTS,Navitas Semiconductor Corporation Common Stock,513690375.0,United States,Technology,Semiconductors
BBW,Build-A-Bear Workshop Inc. Common Stock,513536321.0,United States,Consumer Discretionary,Recreational Games/Products/Toys
ORGO,Organogenesis Holdings Inc. Class A Common Stock,513071063.0,United States,Health Care,Biotechnology: Pharmaceutical Preparations
SLQT,SelectQuote Inc. Common Stock,512798452.0,United States,Finance,Specialty Insurers
BLW,Blackrock Limited Duration Income Trust,511742255.0,United States,Consumer Discretionary,Other Consumer Services
SNDL,SNDL Inc. Common Shares,511643000.0,Canada,Health Care, Medicinal Chemicals and Botanical Products 
KRNY,Kearny Financial Corp Common Stock,511471089.0,United States,Finance,Savings Institutions
SENEB,Seneca Foods Corp. Class B Common Stock,507854834.0,United States,Consumer Staples,Packaged Foods
RDVT,Red Violet Inc. Common Stock ,507532794.0,United States,Technology,Computer Software: Prepackaged Software
TTI,Tetra Technologies Inc. Common Stock,507469258.0,United States,Energy,Oil & Gas Production
GFR,Greenfire Resources Ltd. Common Shares,507119787.0,Canada,Energy,Oil & Gas Production
IVR,INVESCO MORTGAGE CAPITAL INC Common Stock,507097896.0,United States,Real Estate,Real Estate Investment Trusts
VCV,Invesco California Value Municipal Income Trust Common Stock,505723944.0,United States,Finance,Trusts Except Educational Religious and Charitable
EAF,GrafTech International Ltd. Common Stock,504047569.0,United States,Energy,Industrial Machinery/Components
ODC,Oil-Dri Corporation Of America Common Stock,503884040.0,United States,Consumer Discretionary,Miscellaneous manufacturing industries
ALMS,Alumis Inc. Common Stock,503811848.0,United States,Health Care,Biotechnology: Pharmaceutical Preparations
LMNR,Limoneira Co Common Stock,501842848.0,United States,Consumer Staples,Farming/Seeds/Milling
GAIN,Gladstone Investment Corporation Business Development Company,501167191.0,United States,Finance,Finance: Consumer Services
DNA,Ginkgo Bioworks Holdings Inc. Class A Common Stock,500066474.0,United States,Health Care,Biotechnology: Biological Products (No Diagnostic Substances)
PKST,Peakstone Realty Trust Common Shares,499528306.0,United States,Real Estate,Real Estate Investment Trusts
OFLX,Omega Flex Inc. Common Stock,498861393.0,United States,Industrials,Industrial Specialties
GBLI,Global Indemnity Group LLC Class A Common Stock (DE),498100570.0,Ireland,Finance,Property-Casualty Insurers
ZVRA,Zevra Therapeutics Inc. Common Stock,497997446.0,United States,Health Care,Biotechnology: Pharmaceutical Preparations
VZLA,Vizsla Silver Corp. Common Shares,497595458.0,Canada,Basic Materials,Precious Metals
LE,Lands' End Inc. Common Stock,497521603.0,United States,Consumer Discretionary,Clothing/Shoe/Accessory Stores
SNDA,Sonida Senior Living Inc. Common Stock,496964200.0,United States,Health Care,Hospital/Nursing Management
SENEA,Seneca Foods Corp. Class A Common Stock,496829492.0,United States,Consumer Staples,Packaged Foods
ARCT,Arcturus Therapeutics Holdings Inc. Common Stock,496782164.0,Israel,Health Care,Biotechnology: Pharmaceutical Preparations
FARO,FARO Technologies Inc. Common Stock,496579729.0,United States,Industrials,Industrial Machinery/Components
GAMB,Gambling.com Group Limited Ordinary Shares,493571000.0,Jersey,Consumer Discretionary,Services-Misc. Amusement & Recreation
CVGW,Calavo Growers Inc. Common Stock,493281616.0,United States,Consumer Discretionary,Specialty Foods
PHAR,Pharming Group N.V. ADS each representing 10 ordinary shares,493238831.0,Netherlands,Health Care,Biotechnology: Pharmaceutical Preparations
INV,Innventure Inc. Common Stock,492503870.0,United States,Finance,Blank Checks
CPAC,Cementos Pacasmayo S.A.A. American Depositary Shares (Each representing five Common Shares),492322872.0,Peru,Industrials,Building Materials
OUST,Ouster Inc. Common Stock,491733913.0,United States,Industrials,Industrial Machinery/Components
DGICB,Donegal Group Inc. Class B Common Stock,491677031.0,United States,Finance,Property-Casualty Insurers
RGNX,REGENXBIO Inc. Common Stock,491487104.0,United States,Health Care,Biotechnology: Biological Products (No Diagnostic Substances)
VALU,Value Line Inc. Common Stock,490304932.0,United States,Finance,Investment Managers
XERS,Xeris Biopharma Holdings Inc. Common Stock,488987192.0,United States,Health Care,Biotechnology: Pharmaceutical Preparations
GHM,Graham Corporation Common Stock,488086573.0,United States,Industrials,Industrial Machinery/Components
KRRO,Korro Bio Inc. Common Stock,487711720.0,United States,Health Care,Biotechnology: Pharmaceutical Preparations
SHYF,The Shyft Group Inc. Common Stock,486371801.0,United States,Consumer Discretionary,Auto Manufacturing
RIGL,Rigel Pharmaceuticals Inc. Common Stock,486351254.0,United States,Health Care,Biotechnology: Pharmaceutical Preparations
RNW,ReNew Energy Global plc Class A Ordinary Shares,485773604.0,United Kingdom,Utilities,Electric Utilities: Central
TCBX,Third Coast Bancshares Inc. Common Stock,485608192.0,United States,Finance,Banks
HIVE,HIVE Digital Technologies Ltd. Common Shares,484256661.0,Canada,Finance,Finance: Consumer Services
NLOP,Net Lease Office Properties Common Shares of Beneficial Interest,484061358.0,United States,Real Estate,Real Estate Investment Trusts
KE,Kimball Electronics Inc. Common Stock,483987566.0,United States,Technology,Electrical Products
CCSI,Consensus Cloud Solutions Inc. Common Stock,481624770.0,United States,Technology,Computer Software: Prepackaged Software
ZBIO,Zenas BioPharma Inc. Common Stock,481014836.0,United States,Health Care,Biotechnology: Pharmaceutical Preparations
BWMN,Bowman Consulting Group Ltd. Common Stock,480141797.0,United States,Consumer Discretionary,Professional Services
FC,Franklin Covey Company Common Stock,479643779.0,United States,Consumer Discretionary,Other Consumer Services
CBNK,Capital Bancorp Inc. Common Stock,479509254.0,United States,Finance,Major Banks
FLX,BingEx Limited American Depositary Shares,479384393.0,China,Industrials,Trucking Freight/Courier Services
BOC,Boston Omaha Corporation Class A Common Stock,479078949.0,United States,Finance,Real Estate
BH,Biglari Holdings Inc. Class B Common Stock,478834307.0,United States,Consumer Discretionary,Restaurants
RNAC,Cartesian Therapeutics Inc. Common Stock,478562529.0,United States,Health Care,Biotechnology: Pharmaceutical Preparations
CYH,Community Health Systems Inc. Common Stock,477981320.0,United States,Health Care,Hospital/Nursing Management
VLGEA,Village Super Market Inc. Class A Common Stock,477876983.0,United States,Consumer Staples,Food Chains
JMIA,Jumia Technologies AG American Depositary Shares each representing two Ordinary Shares,477594000.0,,Consumer Discretionary,Catalog/Specialty Distribution
RMT,Royce Micro-Cap Trust Inc. Common Stock,477497184.0,United States,Finance,Investment Managers
URG,Ur Energy Inc Common Shares (Canada),476972360.0,Canada,Basic Materials,Precious Metals
MLP,Maui Land & Pineapple Company Inc. Common Stock,476067028.0,United States,Finance,Real Estate
API,Agora Inc. American Depositary Shares,475763228.0,China,Technology,Computer Software: Prepackaged Software
AGS,PlayAGS Inc. Common Stock,475569172.0,United States,Consumer Discretionary,Miscellaneous manufacturing industries
CELC,Celcuity Inc. Common Stock,475258317.0,United States,Health Care,Medical Specialities
VERV,Verve Therapeutics Inc. Common Stock,474964142.0,United States,Health Care,Biotechnology: Pharmaceutical Preparations
NNDM,Nano Dimension Ltd. American Depositary Shares,473553702.0,Israel,Technology,Electrical Products
QTRX,Quanterix Corporation Common Stock,473213477.0,United States,Industrials,Biotechnology: Laboratory Analytical Instruments
OABI,OmniAb Inc. Common Stock,473159200.0,United States,Health Care,Biotechnology: Commercial Physical & Biological Resarch
BSTZ,BlackRock Science and Technology Term Trust Common Shares of Beneficial Interest,472183357.0,United States,Finance,Trusts Except Educational Religious and Charitable
RICK,RCI Hospitality Holdings Inc. Common Stock,471958803.0,United States,Consumer Discretionary,Restaurants
SGMO,Sangamo Therapeutics Inc. Common Stock,471541926.0,United States,Health Care,Biotechnology: Biological Products (No Diagnostic Substances)
BWMX,Betterware de Mexico S.A.P.I. de C.V. Ordinary Shares,470934811.0,Mexico,Consumer Discretionary,Catalog/Specialty Distribution
ZEUS,Olympic Steel Inc. Common Stock,470683876.0,United States,Industrials,Metal Fabrications
GRVY,GRAVITY Co. Ltd. American Depository Shares,469120239.0,South Korea,Consumer Discretionary,Business Services
TCMD,Tactile Systems Technology Inc. Common Stock,468903119.0,United States,Health Care,Medical/Dental Instruments
JPI,Nuveen Preferred Securities & Income Opportunities Fund Common Shares,468200935.0,,Finance,Finance Companies
NRIM,Northrim BanCorp Inc Common Stock,468050291.0,United States,Finance,Savings Institutions
VBNK,VersaBank Common Shares,467099988.0,Canada,Finance,Commercial Banks
AURA,Aura Biosciences Inc. Common Stock,465048148.0,United States,Health Care,Biotechnology: Biological Products (No Diagnostic Substances)
GHRS,GH Research PLC Ordinary Shares,464611335.0,Ireland,Health Care,Biotechnology: Pharmaceutical Preparations
AQST,Aquestive Therapeutics Inc. Common Stock,464097002.0,United States,Health Care,Biotechnology: Pharmaceutical Preparations
DMF,BNY Mellon Municipal Income Inc. Common Stock,464066862.0,United States,Finance,Finance/Investors Services
SVC,Service Properties Trust Common Stock,463282697.0,United States,Real Estate,Real Estate Investment Trusts
TWI,Titan International Inc. (DE) Common Stock,462180664.0,United States,Industrials,Steel/Iron Ore
NRC,National Research Corporation Common Stock (Delaware),461538946.0,United States,Health Care,Biotechnology: Commercial Physical & Biological Resarch
YXT,YXT.COM GROUP HOLDING LIMITED American Depository Shares,461408860.0,China,Technology,Computer Software: Prepackaged Software
ASC,Ardmore Shipping Corporation Common Stock,460959883.0,,Consumer Discretionary,Marine Transportation
EBTC,Enterprise Bancorp Inc Common Stock,459755738.0,United States,Finance,Major Banks
FMAO,Farmers & Merchants Bancorp Inc. Common Stock,459206637.0,United States,Finance,Savings Institutions
SLRN,ACELYRIN INC. Common Stock,456481339.0,United States,Health Care,Biotechnology: Pharmaceutical Preparations
TBPH,Theravance Biopharma Inc. Ordinary Shares,454862238.0,Cayman Islands,Health Care,Biotechnology: Pharmaceutical Preparations
CMPOW,CompoSecure Inc. Warrant,453874691.0,United States,Finance,Finance: Consumer Services
UNTY,Unity Bancorp Inc. Common Stock,453364627.0,United States,Finance,Major Banks
BSRR,Sierra Bancorp Common Stock,452966529.0,United States,Finance,Major Banks
MOV,Movado Group Inc. Common Stock,452209438.0,United States,Consumer Discretionary,Consumer Specialties
HTIA,National Healthcare Properties Inc. 7.375% Series A Cumulative Redeemable Perpetual Preferred Stock,452177095.0,United States,Real Estate,Real Estate Investment Trusts
PKOH,Park-Ohio Holdings Corp. Common Stock,451727633.0,United States,Industrials,Industrial Specialties
CTV,Innovid Corp. Common Stock,451359221.0,,Technology,Computer Software: Prepackaged Software
CANG,Cango Inc. American Depositary Shares  each representing two (2) Class A Ordinary Shares,450920123.0,,Technology,Computer Software: Prepackaged Software
MTLS,Materialise NV American Depositary Shares,450682629.0,Belgium,Technology,Computer Software: Prepackaged Software
CLDT,Chatham Lodging Trust (REIT) Common Shares of Beneficial Interest,450474841.0,United States,Real Estate,Real Estate Investment Trusts
DHIL,Diamond Hill Investment Group Inc. Class A Common Stock,450158100.0,United States,Finance,Investment Managers
WOW,WideOpenWest Inc. Common Stock,450155962.0,United States,Telecommunications,Cable & Other Pay Television Services
AKBA,Akebia Therapeutics Inc. Common Stock,449453276.0,United States,Health Care,Biotechnology: Pharmaceutical Preparations
CLW,Clearwater Paper Corporation Common Stock,449316621.0,United States,Basic Materials,Paper
CURV,Torrid Holdings Inc. Common Stock,449078187.0,,Consumer Discretionary,Clothing/Shoe/Accessory Stores
BIOX,Bioceres Crop Solutions Corp. Ordinary Shares,447481199.0,Argentina,Industrials,Agricultural Chemicals
CLCO,Cool Company Ltd. Common Shares,447344707.0,,Consumer Discretionary,Marine Transportation
BLDP,Ballard Power Systems Inc. Common Shares,446118485.0,Canada,Energy,Industrial Machinery/Components
BSVN,Bank7 Corp. Common stock,445296197.0,United States,Finance,Major Banks
FHTX,Foghorn Therapeutics Inc. Common Stock,444189117.0,United States,Health Care,Biotechnology: Pharmaceutical Preparations
ACTG,Acacia Research Corporation (Acacia Tech) Common Stock,443025151.0,United States,Miscellaneous,Multi-Sector Companies
ETB,Eaton Vance Tax-Managed Buy-Write Income Fund Eaton Vance Tax-Managed Buy-Write Income Fund Common Shares of Beneficial Interest,442626968.0,United States,Finance,Investment Bankers/Brokers/Service
MUX,McEwen Mining Inc. Common Stock,442451504.0,Canada,Basic Materials,Precious Metals
PNNT,PennantPark Investment Corporation Common Stock,442054556.0,United States,Finance,Finance: Consumer Services
DCGO,DocGo Inc. Common Stock,441878708.0,United States,Health Care,Medical/Nursing Services
SGU,Star Group L.P. Common Stock,438813881.0,United States,Consumer Discretionary,Other Specialty Stores
OBE,Obsidian Energy Ltd. Common Shares,437791162.0,Canada,Energy,Oil & Gas Production
PRCH,Porch Group Inc. Common Stock,437529514.0,United States,Technology,Computer Software: Prepackaged Software
ALNT,Allient Inc. Common Stock,437474467.0,United States,Industrials,Electrical Products
YRD,Yiren Digital Ltd. American Depositary Shares each representing two ordinary shares,437280751.0,China,Finance,Finance: Consumer Services
CLFD,Clearfield Inc. Common Stock,437231374.0,United States,Utilities,Telecommunications Equipment
SD,SandRidge Energy Inc. Common Stock,436517851.0,United States,Energy,Oil & Gas Production
TPTA,Terra Property Trust Inc. 6.00% Notes due 2026,435642127.0,,Real Estate,Real Estate Investment Trusts
BYRN,Byrna Technologies Inc. Common Stock,435106683.0,United States,Miscellaneous,Industrial Machinery/Components
KALV,KalVista Pharmaceuticals Inc. Common Stock,434747648.0,United Kingdom,Health Care,Biotechnology: Pharmaceutical Preparations
LAND,Gladstone Land Corporation Common Stock,434577743.0,United States,Real Estate,Real Estate Investment Trusts
MOBBW,Mobilicom Limited Warrants,433130281.0,Israel,Industrials,Aerospace
TRC,Tejon Ranch Co Common Stock,432383020.0,United States,Finance,Real Estate
MYE,Myers Industries Inc. Common Stock,432213819.0,United States,Industrials,Plastic Products
PRME,Prime Medicine Inc. Common Stock,431519170.0,United States,Health Care,Biotechnology: Biological Products (No Diagnostic Substances)
CARE,Carter Bankshares Inc. Common Stock,430985222.0,United States,Finance,Major Banks
MITK,Mitek Systems Inc. Common Stock,430619612.0,United States,Technology,Computer peripheral equipment
MFH,Mercurity Fintech Holding Inc. Ordinary Shares,430604871.0,China,Finance,Finance: Consumer Services
SEG,Seaport Entertainment Group Inc. Common Stock,430068414.0,United States,Consumer Discretionary,Services-Misc. Amusement & Recreation
SOHU,Sohu.com Limited American Depositary Shares,429963379.0,China,Technology,EDP Services
HTIBP,National Healthcare Properties Inc. 7.125% Series B Cumulative Redeemable Perpetual Preferred Stock,429090031.0,United States,Real Estate,Real Estate Investment Trusts
ETO,Eaton Vance Tax-Advantage Global Dividend Opp Common Stock,429041453.0,United States,Finance,Investment Managers
EVN,Eaton Vance Municipal Income Trust Common Stock,428008689.0,United States,Finance,Investment Managers
CWCO,Consolidated Water Co. Ltd. Ordinary Shares,426433776.0,Cayman Islands,Utilities,Water Supply
AIRJ,AirJoule Technologies Corporation Class A Common Stock,426083349.0,United States,Industrials,Industrial Machinery/Components
GTN,Gray Television Inc. Common Stock,425578982.0,United States,Industrials,Broadcasting
LESL,Leslie's Inc. Common Stock,425299449.0,United States,Consumer Discretionary,Other Specialty Stores
XPER,Xperi Inc. Common Stock ,424542174.0,United States,Technology,Computer Software: Prepackaged Software
TNGX,Tango Therapeutics Inc.,423226203.0,United States,Health Care,Biotechnology: Pharmaceutical Preparations
DDT,Dillard's Capital Trust I,423078313.0,United States,Consumer Discretionary,Department/Specialty Retail Stores
NECB,NorthEast Community Bancorp Inc. Common Stock,422721150.0,United States,Finance,Banks
ZUMZ,Zumiez Inc. Common Stock,422450897.0,United States,Consumer Discretionary,Clothing/Shoe/Accessory Stores
RBB,RBB Bancorp Common Stock,422164906.0,United States,Finance,Major Banks
SPIR,Spire Global Inc. Class A Common Stock,421978621.0,United States,Consumer Discretionary,Telecommunications Equipment
LSAK,Lesaka Technologies Inc. Common Stock,421300672.0,South Africa,Finance,Investment Bankers/Brokers/Service
GNTY,Guaranty Bancshares Inc. Common Stock,420400009.0,United States,Finance,Major Banks
FISI,Financial Institutions Inc. Common Stock,420282368.0,United States,Finance,Major Banks
TRAK,ReposiTrak Inc. Common Stock,419637366.0,United States,Technology,EDP Services
COOK,Traeger Inc. Common Stock,419231961.0,United States,Consumer Discretionary,Consumer Electronics/Appliances
GDEV,GDEV Inc. Ordinary Shares,418981518.0,Cyprus,Technology,EDP Services
WDH,Waterdrop Inc. American Depositary Shares (each representing the right to receive 10 Class A Ordinary Shares),418283287.0,Cayman Islands,Finance,Specialty Insurers
JILL,J. Jill Inc. Common Stock,416328226.0,United States,Consumer Discretionary,Apparel
OTLY,Oatly Group AB American Depositary Shares,416066132.0,Sweden,Consumer Staples,Packaged Foods
FBIZ,First Business Financial Services Inc. Common Stock,415746252.0,United States,Finance,Major Banks
AMCX,AMC Networks Inc. Class A Common Stock,415617738.0,United States,Telecommunications,Cable & Other Pay Television Services
CWBC,Community West Bancshares Common Stock,415288516.0,United States,Finance,Major Banks
GNE,Genie Energy Ltd. Class B Common Stock Stock,415070581.0,United States,Utilities,Power Generation
LSEA,Landsea Homes Corporation Common Stock,414713353.0,United States,Consumer Discretionary,Homebuilding
SMLR,Semler Scientific Inc. Common Stock,414321119.0,United States,Health Care,Biotechnology: Electromedical & Electrotherapeutic Apparatus
PERI,Perion Network Ltd. Ordinary Shares,413685385.0,Israel,Technology,EDP Services
USAP,Universal Stainless & Alloy Products Inc. Common Stock,413553265.0,United States,Industrials,Steel/Iron Ore
PAMT,PAMT CORP Common Stock,413214670.0,United States,Industrials,Trucking Freight/Courier Services
SB,Safe Bulkers Inc Common Stock ($0.001 par value),413201525.0,Monaco,Consumer Discretionary,Marine Transportation
WALD,Waldencast plc Class A Ordinary Share,412999300.0,United States,Consumer Discretionary,Package Goods/Cosmetics
MERC,Mercer International Inc. Common Stock,412592676.0,Canada,Basic Materials,Paper
SDHY,PGIM Short Duration High Yield Opportunities Fund Common Shares,412040035.0,,Finance,Finance/Investors Services
RRBI,Red River Bancshares Inc. Common Stock,409908506.0,United States,Consumer Discretionary,Hotels/Resorts
LND,Brasilagro Brazilian Agric Real Estate Co Sponsored ADR (Brazil),409706942.0,Brazil,Consumer Staples,Farming/Seeds/Milling
HBCP,Home Bancorp Inc. Common Stock,409699538.0,United States,Finance,Banks
VKI,Invesco Advantage Municipal Income Trust II Common Shares of Beneficial Interest (DE),408979444.0,United States,Finance,Finance Companies
BWB,Bridgewater Bancshares Inc. Common Stock,408642781.0,United States,Finance,Major Banks
ZIMV,ZimVie Inc. Common Stock,407359336.0,United States,Health Care,Medical/Dental Instruments
BMRC,Bank of Marin Bancorp Common Stock,406575232.0,United States,Finance,Major Banks
USCB,USCB Financial Holdings Inc. Class A Common Stock,406336143.0,United States,Finance,Major Banks
RILYN,B. Riley Financial Inc. 6.50% Senior Notes Due 2026,405957060.0,United States,Finance,Investment Managers
EGHT,8x8 Inc Common Stock,405048316.0,United States,Technology,EDP Services
LRMR,Larimar Therapeutics Inc. Common Stock,403895955.0,United States,Health Care,Biotechnology: Pharmaceutical Preparations
ZJK,ZJK Industrial Co. Ltd. Ordinary Shares,403025000.0,China,Industrials,Metal Fabrications
DDD,3D Systems Corporation Common Stock,402791899.0,United States,Technology,Computer Software: Prepackaged Software
SMC,Summit Midstream Corporation Common Stock,402413806.0,United States,Utilities,Natural Gas Distribution
WTBA,West Bancorporation Common Stock,401794926.0,United States,Finance,Major Banks
LEO,BNY Mellon Strategic Municipals Inc. Common Stock,401153100.0,United States,Finance,Trusts Except Educational Religious and Charitable
ACNB,ACNB Corporation Common Stock,400588568.0,United States,Finance,Major Banks
MCI,Barings Corporate Investors Common Stock,400168950.0,United States,Finance,Trusts Except Educational Religious and Charitable
TKNO,Alpha Teknova Inc. Common Stock,398208437.0,United States,Health Care,Biotechnology: In Vitro & In Vivo Diagnostic Substances
KTF,DWS Municipal Income Trust,397379436.0,United States,Finance,Finance Companies
OOMA,Ooma Inc. Common Stock,396640000.0,United States,Technology,EDP Services
CGC,Canopy Growth Corporation Common Shares,396516674.0,Canada,Health Care, Medicinal Chemicals and Botanical Products 
RILYG,B. Riley Financial Inc. 5.00% Senior Notes due 2026,396262563.0,United States,Finance,Investment Managers
ASPI,ASP Isotopes Inc. Common Stock,396215094.0,United States,Industrials,Major Chemicals
AIRS,AirSculpt Technologies Inc. Common Stock,395336000.0,United States,Health Care,Medical/Nursing Services
GEVO,Gevo Inc. Common Stock,395022289.0,United States,Industrials,Major Chemicals
GTI,Graphjet Technology Class A Ordinary Shares,394734113.0,Malaysia,Energy,Industrial Machinery/Components
XOMA,XOMA Royalty Corporation Common Stock,394132084.0,United States,Health Care,Biotechnology: Pharmaceutical Preparations
ACRE,Ares Commercial Real Estate Corporation Common Stock,393794525.0,United States,Real Estate,Real Estate Investment Trusts
VENU,Venu Holding Corporation Common Stock,393356207.0,,Consumer Discretionary,Services-Misc. Amusement & Recreation
EFT,Eaton Vance Floating Rate Income Trust Common Shares of Beneficial Interest,390975178.0,United States,Finance,Finance Companies
RWAY,Runway Growth Finance Corp. Common Stock,389330065.0,United States,Finance,Finance: Consumer Services
EHAB,Enhabit Inc. Common Stock,388696248.0,United States,Health Care,Medical/Nursing Services
NL,NL Industries Inc. Common Stock,388339485.0,United States,Industrials,Major Chemicals
ASA,ASA  Gold and Precious Metals Limited,387895690.0,United States,Industrials,Precious Metals
CRNT,Ceragon Networks Ltd. Ordinary Shares,387799177.0,Israel,Technology,Radio And Television Broadcasting And Communications Equipment
