Symbol,Name,Market Cap,Country,Sector,Industry
SAM,Boston Beer Company Inc. (The) Common Stock,3631937656.0,United States,Consumer Staples,Beverages (Production/Distribution)
PBF,PBF Energy Inc. Class A Common Stock,3625238070.0,United States,Energy,Integrated oil Companies
STR,Sitio Royalties Corp. Class A Common Stock,3624092231.0,United States,Energy,Oil & Gas Production
COMP,Compass Inc. Class A Common Stock,3618077984.0,United States,Technology,EDP Services
ARLP,Alliance Resource Partners L.P. Common Units representing Limited Partners Interests,3615189724.0,United States,Energy,Coal Mining
OR,Osisko Gold Royalties Ltd Common Shares,3609121625.0,Canada,Basic Materials,Precious Metals
YOU,Clear Secure Inc. Class A Common Stock,3607791203.0,United States,Technology,Computer Software: Prepackaged Software
FRO,Frontline Plc Ordinary Shares,3602038344.0,Bermuda,Consumer Discretionary,Marine Transportation
DNLI,Denali Therapeutics Inc. Common Stock,3598040600.0,United States,Health Care,Biotechnology: Biological Products (No Diagnostic Substances)
ATMU,Atmus Filtration Technologies Inc. Common Stock,3597228134.0,United States,Consumer Discretionary,Auto Parts:O.E.M.
SLAB,Silicon Laboratories Inc. Common Stock,3590375294.0,United States,Technology,Semiconductors
ABM,ABM Industries Incorporated Common Stock,3589776277.0,United States,Finance,Diversified Commercial Services
CXT,Crane NXT Co. Common Stock,3583930328.0,United States,Industrials,Metal Fabrications
BRC,Brady Corporation Common Stock,3576922242.0,United States,Consumer Discretionary,Miscellaneous manufacturing industries
DHCNI,Diversified Healthcare Trust 5.625% Senior Notes due 2042,3574938719.0,United States,Real Estate,Real Estate Investment Trusts
DOOO,BRP Inc. (Recreational Products) Common Subordinate Voting Shares,3557414603.0,Canada,Consumer Discretionary,Industrial Specialties
ALVO,Alvotech Ordinary Shares,3547795000.0,Luxembourg,Health Care,Biotechnology: Biological Products (No Diagnostic Substances)
KGS,Kodiak Gas Services Inc. Common Stock,3541317819.0,United States,Utilities,Natural Gas Distribution
WSFS,WSFS Financial Corporation Common Stock,3535048957.0,United States,Finance,Major Banks
PCH,PotlatchDeltic Corporation Common Stock,3531732920.0,United States,Real Estate,Real Estate Investment Trusts
FHB,First Hawaiian Inc. Common Stock,3530937071.0,United States,Finance,Major Banks
HBM,Hudbay Minerals Inc. Ordinary Shares (Canada),3521768270.0,Canada,Basic Materials,Metal Mining
HL,Hecla Mining Company Common Stock,3516325207.0,United States,Industrials,Mining & Quarrying of Nonmetallic Minerals (No Fuels)
DOCN,DigitalOcean Holdings Inc. Common Stock,3514109451.0,United States,Technology,Computer Software: Programming Data Processing
NAN,Nuveen New York Quality Municipal Income Fund Common Stock,3512909596.0,United States,Finance,Investment Managers
IBRX,ImmunityBio Inc. Common Stock,3512029732.0,United States,Health Care,Biotechnology: Biological Products (No Diagnostic Substances)
CWK,Cushman & Wakefield plc Ordinary Shares,3511149937.0,,Finance,Real Estate
FHI,Federated Hermes Inc. Common Stock,3497536188.0,United States,Finance,Investment Managers
ASAN,Asana Inc. Class A Common Stock,3493196137.0,United States,Technology,Computer Software: Prepackaged Software
FGN,F&G Annuities & Life Inc. 7.950% Senior Notes due 2053,3486624852.0,United States,Finance,Life Insurance
NHI,National Health Investors Inc. Common Stock,3481601206.0,United States,Real Estate,Real Estate Investment Trusts
HAYW,Hayward Holdings Inc. Common Stock,3481260890.0,United States,Industrials,Industrial Machinery/Components
CWEN,Clearway Energy Inc. Class C Common Stock,3479820000.0,United States,Utilities,Electric Utilities: Central
MLTX,MoonLake Immunotherapeutics Class A Ordinary Shares,3478359927.0,United States,Health Care,Biotechnology: Pharmaceutical Preparations
FROG,JFrog Ltd. Ordinary Shares,3475194023.0,United States,Technology,Computer Software: Prepackaged Software
VAC,Marriott Vacations Worldwide Corporation Common Stock,3464932729.0,United States,Finance,Real Estate
ASO,Academy Sports and Outdoors Inc. Common Stock,3462699141.0,United States,Consumer Discretionary,Other Specialty Stores
ATAT,Atour Lifestyle Holdings Limited American Depositary Shares,3460520185.0,China,Consumer Discretionary,Hotels/Resorts
SOUN,SoundHound AI Inc Class A Common Stock,3442374595.0,United States,Technology,Computer Software: Prepackaged Software
HIW,Highwoods Properties Inc. Common Stock,3441423028.0,United States,Real Estate,Real Estate Investment Trusts
DV,DoubleVerify Holdings Inc. Common Stock,3439124633.0,United States,Technology,Computer Software: Programming Data Processing
MP,MP Materials Corp. Common Stock,3438776210.0,United States,Basic Materials,Metal Mining
NSA,National Storage Affiliates Trust Common Shares of Beneficial Interest,3438620365.0,United States,Real Estate,Real Estate Investment Trusts
LBRDP,Liberty Broadband Corporation Series A Cumulative Redeemable Preferred Stock,3436925142.0,United States,Telecommunications,Cable & Other Pay Television Services
EPR,EPR Properties Common Stock,3435938019.0,United States,Real Estate,Real Estate Investment Trusts
ZIONP,Zions Bancorporation N.A. Depositary Shares (Each representing 1/40th Interest in a Share of Series A Floating-Rate Non-Cumulative Perpetual Preferred Stock),3429263637.0,United States,Finance,Major Banks
ATGE,Adtalem Global Education Inc. Common Stock,3427034759.0,United States,Real Estate,Other Consumer Services
YETI,YETI Holdings Inc. Common Stock,3424403417.0,United States,Consumer Discretionary,Recreational Games/Products/Toys
HP,Helmerich & Payne Inc. Common Stock,3419899918.0,United States,Energy,Oil & Gas Production
UEC,Uranium Energy Corp. Common Stock,3418782622.0,Canada,Basic Materials,Other Metals and Minerals
RNG,RingCentral Inc. Class A Common Stock,3402902688.0,United States,Technology,EDP Services
FLNC,Fluence Energy Inc. Class A Common Stock,3395024838.0,United States,Miscellaneous,Industrial Machinery/Components
CRGY,Crescent Energy Company Class A Common Stock,3394729535.0,United States,Energy,Oil & Gas Production
FBP,First BanCorp. New Common Stock,3388836398.0,Puerto Rico,Finance,Major Banks
HUN,Huntsman Corporation Common Stock,3387187687.0,United States,Industrials,Major Chemicals
AGIO,Agios Pharmaceuticals Inc. Common Stock,3387023281.0,United States,Health Care,Biotechnology: Pharmaceutical Preparations
NWE,NorthWestern Energy Group Inc. Common Stock,3386997347.0,United States,Utilities,Power Generation
BBAR,Banco BBVA Argentina S.A. ADS,3386244370.0,Argentina,Finance,Commercial Banks
DLO,DLocal Limited Class A Common Shares,3386144648.0,Uruguay,Consumer Discretionary,Business Services
JJSF,J & J Snack Foods Corp. Common Stock,3385157914.0,United States,Consumer Staples,Specialty Foods
PTCT,PTC Therapeutics Inc. Common Stock,3384251275.0,United States,Health Care,Biotechnology: Pharmaceutical Preparations
IRDM,Iridium Communications Inc Common Stock,3383556081.0,United States,Telecommunications,Telecommunications Equipment
LPL,LG Display Co Ltd AMERICAN DEPOSITORY SHARES,3380000000.0,South Korea,Technology,Industrial Machinery/Components
IPGP,IPG Photonics Corporation Common Stock,3375080163.0,United States,Technology,Semiconductors
OTTR,Otter Tail Corporation Common Stock,3373007259.0,United States,Utilities,Electric Utilities: Central
TFPM,Triple Flag Precious Metals Corp. Common Shares,3370788958.0,Canada,Industrials,Precious Metals
TAC,TransAlta Corporation Ordinary Shares,3361110000.0,Canada,Utilities,Electric Utilities: Central
BTSG,BrightSpring Health Services Inc. Common Stock,3360640041.0,United States,Health Care,Medical/Nursing Services
GEF,Greif Inc. Class A Common Stock,3351189220.0,United States,,
RWTO,Redwood Trust Inc. 9.00% Senior Notes Due 2029,3346347055.0,United States,Real Estate,Real Estate Investment Trusts
CAMT,Camtek Ltd. Ordinary Shares,3345170839.0,Israel,Technology,Electronic Components
GNW,Genworth Financial Inc Common Stock,3330852853.0,United States,Finance,Life Insurance
VCYT,Veracyte Inc. Common Stock,3328609066.0,United States,Health Care,Medical Specialities
BXMT,Blackstone Mortgage Trust Inc. Common Stock,3324844717.0,United States,Real Estate,Real Estate Investment Trusts
ATHM,Autohome Inc. American Depositary Shares each representing four class A ordinary shares.,3324570433.0,China,Technology,EDP Services
RWTN,Redwood Trust Inc. 9.125% Senior Notes Due 2029,3322539052.0,United States,Real Estate,Real Estate Investment Trusts
FA,First Advantage Corporation Common Stock,3320107325.0,United States,Consumer Discretionary,Business Services
SGHC,Super Group (SGHC) Limited Ordinary Shares,3311293319.0,,Consumer Discretionary,Services-Misc. Amusement & Recreation
AVPT,AvePoint Inc. Class A Common Stock,3309574463.0,United States,Technology,Computer Software: Prepackaged Software
CORZW,Core Scientific Inc. Tranche 1 Warrants,3303563274.0,United States,Finance,Finance: Consumer Services
BNL,Broadstone Net Lease Inc. Common Stock,3301462593.0,United States,Real Estate,Real Estate Investment Trusts
SNEX,StoneX Group Inc. Common Stock,3298664043.0,United States,Finance,Investment Bankers/Brokers/Service
PENN,PENN Entertainment Inc. Common Stock,3295268789.0,United States,Consumer Discretionary,Hotels/Resorts
ATKR,Atkore Inc. Common Stock,3291701176.0,United States,Miscellaneous,Industrial Machinery/Components
EE,Excelerate Energy Inc. Class A Common Stock,3291630717.0,United States,Utilities,Oil/Gas Transmission
SHOO,Steven Madden Ltd. Common Stock,3290466874.0,United States,Consumer Discretionary,Shoe Manufacturing
SXT,Sensient Technologies Corporation Common Stock,3288891347.0,United States,Industrials,Major Chemicals
VAL,Valaris Limited Common Shares,3284958573.0,United States,Energy,Oil & Gas Production
PTEN,Patterson-UTI Energy Inc. Common Stock,3275634205.0,United States,Energy,Oil & Gas Production
CVBF,CVB Financial Corporation Common Stock,3271249720.0,United States,Finance,Major Banks
BSM,Black Stone Minerals L.P. Common units representing limited partner interests,3269985360.0,United States,Energy,Oil & Gas Production
VRN,Veren Inc. Common shares,3269284171.0,Canada,Energy,Oil & Gas Production
RSI,Rush Street Interactive Inc. Class A Common Stock,3254535772.0,United States,Consumer Discretionary,Services-Misc. Amusement & Recreation
XENE,Xenon Pharmaceuticals Inc. Common Shares,3250094233.0,Canada,Health Care,Biotechnology: Pharmaceutical Preparations
CC,Chemours Company (The) Common Stock,3248184400.0,United States,Industrials,Major Chemicals
ECG,Everus Construction Group Inc. Common Stock,3244881276.0,United States,Consumer Discretionary,Homebuilding
PYCR,Paycor HCM Inc. Common Stock,3244638235.0,United States,Technology,Computer Software: Prepackaged Software
VRNA,Verona Pharma plc American Depositary Share,3242969267.0,United Kingdom,Health Care,Biotechnology: Pharmaceutical Preparations
DEI,Douglas Emmett Inc. Common Stock,3241546614.0,United States,Real Estate,Real Estate Investment Trusts
ARWR,Arrowhead Pharmaceuticals Inc. Common Stock,3239028525.0,United States,Health Care,Biotechnology: Pharmaceutical Preparations
PRKS,United Parks & Resorts Inc. Common Stock,3225405826.0,United States,Health Care,Biotechnology: Electromedical & Electrotherapeutic Apparatus
AWR,American States Water Company Common Stock,3224451236.0,United States,Utilities,Water Supply
ALRM,Alarm.com Holdings Inc. Common Stock,3219811118.0,United States,Technology,Computer Software: Prepackaged Software
SSL,Sasol Ltd. American Depositary Shares,3217140223.0,South Africa,Energy,Oil & Gas Production
SYNA,Synaptics Incorporated Common Stock $0.001 Par Value,3214288824.0,United States,Technology,Semiconductors
UGP,Ultrapar Participacoes S.A. (New) American Depositary Shares (Each representing one Common Share),3214029918.0,Brazil,Utilities,Oil/Gas Transmission
POWL,Powell Industries Inc. Common Stock,3213492626.0,United States,Energy,Electrical Products
PK,Park Hotels & Resorts Inc. Common Stock ,3209591825.0,United States,Consumer Discretionary,Hotels/Resorts
ATS,ATS Corporation Common Shares,3201206203.0,Canada,Industrials,Industrial Machinery/Components
AMR,Alpha Metallurgical Resources Inc. Common Stock,3196341576.0,United States,Energy,Coal Mining
OUT,OUTFRONT Media Inc. Common Stock,3188586776.0,United States,Real Estate,Real Estate Investment Trusts
GRBK,Green Brick Partners Inc. Common Stock,3179844802.0,United States,Consumer Discretionary,Homebuilding
IFS,Intercorp Financial Services Inc. Common Shares,3176820278.0,,Finance,Commercial Banks
HUBG,Hub Group Inc. Class A Common Stock,3168764871.0,United States,Consumer Discretionary,Oil Refining/Marketing
TBBB,BBB Foods Inc. Class A Common Shares,3166305221.0,,Consumer Staples,Food Chains
NMIH,NMI Holdings Inc. Common Stock,3164488760.0,United States,Finance,Property-Casualty Insurers
MEOH,Methanex Corporation Common Stock,3159125625.0,Canada,Industrials,Major Chemicals
VERA,Vera Therapeutics Inc. Class A Common Stock,3150321887.0,United States,Health Care,Biotechnology: Pharmaceutical Preparations
OMAB,Grupo Aeroportuario del Centro Norte S.A.B. de C.V. ADS,3148728941.0,Mexico,Consumer Discretionary,Aerospace
BKU,BankUnited Inc. Common Stock,3144690935.0,United States,Finance,Savings Institutions
BOH,Bank of Hawaii Corporation Common Stock,3139309124.0,United States,Finance,Major Banks
PLTK,Playtika Holding Corp. Common Stock,3138244799.0,Israel,Technology,EDP Services
IAG,Iamgold Corporation Ordinary Shares,3136650000.0,Canada,Basic Materials,Precious Metals
EWTX,Edgewise Therapeutics Inc. Common Stock,3124721061.0,United States,Health Care,Biotechnology: Pharmaceutical Preparations
GPOR,Gulfport Energy Corporation Common Shares,3116547064.0,United States,Energy,Oil & Gas Production
DYN,Dyne Therapeutics Inc. Common Stock,3115055974.0,United States,Health Care,Biotechnology: Pharmaceutical Preparations
ARCH,Arch Resources Inc. Class A Common Stock,3113232059.0,United States,Energy,Coal Mining
RLX,RLX Technology Inc. American Depositary Shares each representing the right to receive one (1) Class A ordinary share,3110165329.0,Cayman Islands,Health Care, Medicinal Chemicals and Botanical Products 
DFH,Dream Finders Homes Inc. Class A Common Stock,3109954272.0,United States,Consumer Discretionary,Homebuilding
FIVN,Five9 Inc. Common Stock,3104603124.0,United States,Technology,EDP Services
FORM,FormFactor Inc. FormFactor Inc. Common Stock,3102672438.0,United States,Technology,Semiconductors
BHF,Brighthouse Financial Inc. Common Stock,3102446752.0,United States,Finance,Life Insurance
TRN,Trinity Industries Inc. Common Stock,3097546495.0,United States,Industrials,Railroads
AKR,Acadia Realty Trust Common Stock,3093079320.0,United States,Real Estate,Real Estate Investment Trusts
IIPR,Innovative Industrial Properties Inc. Common Stock,3088736434.0,United States,Finance,Real Estate
SWTX,SpringWorks Therapeutics Inc. Common Stock,3085547996.0,United States,Health Care,Biotechnology: Biological Products (No Diagnostic Substances)
CAAP,Corporacion America Airports SA Common Shares,3084909162.0,,Consumer Discretionary,Aerospace
CSAN,Cosan S.A. ADS,3082165974.0,Brazil,Consumer Discretionary,Retail-Auto Dealers and Gas Stations
BHC,Bausch Health Companies Inc. Common Stock,3078514466.0,Canada,Health Care,Biotechnology: Pharmaceutical Preparations
LCII,LCI Industries,3076107832.0,United States,Consumer Discretionary,Auto Parts:O.E.M.
INDB,Independent Bank Corp. Common Stock,3076052706.0,United States,Finance,Major Banks
PRK,Park National Corporation Common Stock,3076023814.0,United States,Finance,Major Banks
HTGC,Hercules Capital Inc. Common Stock,3075173010.0,United States,Finance,Investment Managers
BVN,Buenaventura Mining Company Inc.,3073241091.0,Peru,Basic Materials,Metal Mining
NEOG,Neogen Corporation Common Stock,3072779597.0,United States,Health Care,Biotechnology: In Vitro & In Vivo Diagnostic Substances
SFNC,Simmons First National Corporation Class A Common Stock,3071523799.0,United States,Finance,Major Banks
MRUS,Merus N.V. Common Shares,3069911456.0,Netherlands,Health Care,Biotechnology: Pharmaceutical Preparations
HBI,Hanesbrands Inc. Common Stock,3066715017.0,United States,Consumer Discretionary,Clothing/Shoe/Accessory Stores
AVA,Avista Corporation Common Stock,3063583190.0,United States,Utilities,Power Generation
GT,The Goodyear Tire & Rubber Company Common Stock,3060037288.0,United States,Consumer Discretionary,Automotive Aftermarket
VSCO,Victorias Secret & Co. Common Stock ,3049929721.0,United States,Consumer Discretionary,Clothing/Shoe/Accessory Stores
WULF,TeraWulf Inc. Common Stock,3044811603.0,United States,Technology,EDP Services
CWT,California Water Service Group Common Stock,3044437664.0,United States,Utilities,Water Supply
NARI,Inari Medical Inc. Common Stock,3039612683.0,United States,Health Care,Medical/Dental Instruments
KYMR,Kymera Therapeutics Inc. Common Stock,3034253087.0,United States,Health Care,Biotechnology: Biological Products (No Diagnostic Substances)
SGRY,Surgery Partners Inc. Common Stock,3030386174.0,United States,Health Care,Hospital/Nursing Management
OII,Oceaneering International Inc. Common Stock,3029778650.0,United States,Energy,Oilfield Services/Equipment
TGNA,TEGNA Inc,3024255210.0,United States,Industrials,Broadcasting
MAN,ManpowerGroup Common Stock,3021293686.0,United States,Consumer Discretionary,Professional Services
DIOD,Diodes Incorporated Common Stock,3011637330.0,United States,Technology,Semiconductors
PATK,Patrick Industries Inc. Common Stock,3010304015.0,United States,Consumer Discretionary,Auto Parts:O.E.M.
LBRT,Liberty Energy Inc. Class A common stock,3006848604.0,United States,Energy,Oilfield Services/Equipment
CPK,Chesapeake Utilities Corporation Common Stock,3001372903.0,United States,Utilities,Oil & Gas Production
AMED,Amedisys Inc Common Stock,2993780885.0,United States,Health Care,Medical/Nursing Services
CII,Blackrock Capital and Income Fund Inc.,2993100917.0,United States,Finance,Investment Bankers/Brokers/Service
MGRC,McGrath RentCorp Common Stock,2991561770.0,United States,Consumer Discretionary,Diversified Commercial Services
BUR,Burford Capital Limited Ordinary Shares,2990713355.0,,Finance,Finance: Consumer Services
NOMD,Nomad Foods Limited Ordinary Shares,2987590224.0,United Kingdom,Consumer Staples,Packaged Foods
JOE,St. Joe Company (The) Common Stock,2982944606.0,United States,Real Estate,Homebuilding
FOLD,Amicus Therapeutics Inc. Common Stock,2982081615.0,United States,Health Care,Biotechnology: Pharmaceutical Preparations
WAFD,WaFd Inc. Common Stock,2975875621.0,United States,Finance,Major Banks
OSIS,OSI Systems Inc. Common Stock (DE),2964486873.0,United States,Technology,Semiconductors
IOSP,Innospec Inc. Common Stock,2958322702.0,United States,Industrials,Major Chemicals
TDC,Teradata Corporation Common Stock,2957130000.0,United States,Technology,Computer Software: Prepackaged Software
HCM,HUTCHMED (China) Limited American Depositary Shares,2953909451.0,Hong Kong,Health Care,Biotechnology: Pharmaceutical Preparations
AMBA,Ambarella Inc. Ordinary Shares,2953190117.0,United States,Technology,Semiconductors
NSP,Insperity Inc. Common Stock,2947664453.0,United States,Consumer Discretionary,Professional Services
PAR,PAR Technology Corporation Common Stock,2945794759.0,United States,Miscellaneous,Office Equipment/Supplies/Services
PRGS,Progress Software Corporation Common Stock (DE),2935132760.0,United States,Technology,Computer Software: Prepackaged Software
STNE,StoneCo Ltd. Class A Common Shares,2928714219.0,Brazil,Technology,EDP Services
BFH,Bread Financial Holdings Inc. Common Stock,2924737097.0,United States,Consumer Discretionary,Business Services
TWST,Twist Bioscience Corporation Common Stock,2919149719.0,United States,Health Care,Biotechnology: Biological Products (No Diagnostic Substances)
CNXC,Concentrix Corporation Common Stock,2913602768.0,United States,Technology,Computer Software: Prepackaged Software
TMDX,TransMedics Group Inc. Common Stock,2910119139.0,United States,Health Care,Biotechnology: Electromedical & Electrotherapeutic Apparatus
BTU,Peabody Energy Corporation Common Stock ,2897775000.0,United States,Energy,Coal Mining
HTLF,Heartland Financial USA Inc. Common Stock,2897773100.0,United States,Finance,Major Banks
SBSW,D/B/A Sibanye-Stillwater Limited ADS,2894053583.0,South Africa,Basic Materials,Precious Metals
CSQ,Calamos Strategic Total Return Common Stock,2882221463.0,United States,Finance,Finance Companies
LSPD,Lightspeed Commerce Inc. Subordinate Voting Shares,2880878517.0,Canada,Technology,Computer Software: Prepackaged Software
LFST,LifeStance Health Group Inc. Common Stock,2877453522.0,United States,Health Care,Medical/Nursing Services
MANU,Manchester United Ltd. Class A Ordinary Shares,2875015701.0,United Kingdom,Consumer Discretionary,Services-Misc. Amusement & Recreation
OKLO,Oklo Inc. Class A common stock,2874146196.0,United States,Utilities,Electric Utilities: Central
FCPT,Four Corners Property Trust Inc. Common Stock,2873961079.0,United States,Real Estate,Real Estate Investment Trusts
ZLAB,Zai Lab Limited American Depositary Shares,2873712928.0,China,Health Care,Biotechnology: Pharmaceutical Preparations
UE,Urban Edge Properties Common Shares of Beneficial Interest,2873289694.0,United States,Finance,Real Estate
WLYB,John Wiley & Sons Inc. Common Stock,2871365184.0,United States,Consumer Discretionary,Books
VCEL,Vericel Corporation Common Stock,2869697841.0,United States,Health Care,Biotechnology: Biological Products (No Diagnostic Substances)
PLMR,Palomar Holdings Inc. Common stock,2866253396.0,United States,Finance,Property-Casualty Insurers
LAUR,Laureate Education Inc. Common Stock,2863013689.0,United States,Real Estate,Other Consumer Services
FTAIM,FTAI Aviation Ltd. 9.500% Fixed-Rate Reset Series D Cumulative Perpetual Redeemable Preferred Shares,2859085051.0,United States,Industrials,Misc Corporate Leasing Services
LIVN,LivaNova PLC Ordinary Shares,2850793838.0,United Kingdom,Health Care,Biotechnology: Electromedical & Electrotherapeutic Apparatus
MLCO,Melco Resorts & Entertainment Limited American Depositary Shares,2845513206.0,Hong Kong,Consumer Discretionary,Hotels/Resorts
IOVA,Iovance Biotherapeutics Inc. Common Stock,2840556963.0,United States,Health Care,Biotechnology: Biological Products (No Diagnostic Substances)
WLY,John Wiley & Sons Inc. Common Stock,2832284221.0,United States,Consumer Discretionary,Books
CCS,Century Communities Inc. Common Stock,2831616922.0,United States,Consumer Discretionary,Homebuilding
FLYW,Flywire Corporation Voting Common Stock,2825511819.0,United States,Consumer Discretionary,Business Services
FFBC,First Financial Bancorp. Common Stock,2819794688.0,United States,Finance,Major Banks
HWKN,Hawkins Inc. Common Stock,2812704310.0,United States,Consumer Discretionary,Specialty Chemicals
USAC,USA Compression Partners LP Common Units Representing Limited Partner Interests,2807377764.0,United States,Utilities,Natural Gas Distribution
KLC,KinderCare Learning Companies Inc. Common Stock,2806413257.0,,Consumer Discretionary,Other Consumer Services
KWR,Quaker Houghton Common Stock,2805138110.0,United States,Industrials,Major Chemicals
TBBK,The Bancorp Inc Common Stock,2800672778.0,United States,Finance,Major Banks
APPN,Appian Corporation Class A Common Stock,2796633775.0,United States,Technology,Computer Software: Prepackaged Software
AZZ,AZZ Inc.,2782739309.0,United States,Industrials,Industrial Specialties
CON,Concentra Group Holdings Parent Inc. Common Stock,2778635235.0,,Health Care,Medical Specialities
IBTX,Independent Bank Group Inc Common Stock,2772901671.0,United States,Finance,Major Banks
ABR,Arbor Realty Trust Common Stock,2766890759.0,United States,Real Estate,Real Estate Investment Trusts
RUM,Rumble Inc. Class A Common Stock,2765578247.0,United States,Technology,Computer Software: Programming Data Processing
DRVN,Driven Brands Holdings Inc. Common Stock,2765322568.0,United States,Consumer Discretionary,Automotive Aftermarket
ENVA,Enova International Inc. Common Stock,2765006877.0,United States,Finance,Finance: Consumer Services
CPRI,Capri Holdings Limited Ordinary Shares,2759908770.0,Hong Kong,Consumer Discretionary,Apparel
NPWR,NET Power Inc. Class A Common Stock,2759521220.0,United States,Energy,Industrial Machinery/Components
QDEL,QuidelOrtho Corporation Common Stock,2757525397.0,United States,Health Care,Biotechnology: In Vitro & In Vivo Diagnostic Substances
PFS,Provident Financial Services Inc Common Stock,2755913466.0,United States,Finance,Savings Institutions
PCTTU,PureCycle Technologies Inc. Unit,2755048831.0,United States,Industrials,Major Chemicals
PSMT,PriceSmart Inc. Common Stock,2753826343.0,United States,Consumer Discretionary,Department/Specialty Retail Stores
LXP,LXP Industrial Trust Common Stock (Maryland REIT),2753663535.0,United States,Real Estate,Real Estate Investment Trusts
NMFCZ,New Mountain Finance Corporation 8.250% Notes due 2028,2749132568.0,United States,,
ENR,Energizer Holdings Inc. Common Stock,2740825125.0,United States,Miscellaneous,Industrial Machinery/Components
PPBI,Pacific Premier Bancorp Inc,2738913750.0,United States,Finance,Major Banks
BANC,Banc of California Inc. Common Stock,2736243387.0,United States,Finance,Major Banks
TOWN,TowneBank Common Stock,2733232798.0,United States,Finance,Major Banks
SEM,Select Medical Holdings Corporation Common Stock,2733046956.0,United States,Health Care,Hospital/Nursing Management
BBUC,Brookfield Business Corporation Class A Exchangeable Subordinate Voting Shares,2728335701.0,,Consumer Discretionary,Engineering & Construction
ENOV,Enovis Corporation Common Stock,2727281007.0,United States,Health Care,Industrial Specialties
IRTC,iRhythm Technologies Inc. Common Stock,2721833527.0,United States,Health Care,Medical/Dental Instruments
