Symbol,Name,Market Cap,Country,Sector,Industry
CMCT,Creative Media & Community Trust Corporation Common stock,23241550.0,United States,Real Estate,Real Estate Investment Trusts
JVA,Coffee Holding Co. Inc. Common Stock,23233998.0,United States,Consumer Staples,Packaged Foods
SIF,SIFCO Industries Inc. Common Stock,23174554.0,United States,Industrials,Aerospace
LSTA,Lisata Therapeutics Inc. Common Stock,23169932.0,United States,Health Care,Misc Health and Biotechnology Services
TMCWW,TMC the metals company Inc. Warrants,23055075.0,Canada,Basic Materials,Metal Mining
XTKG,X3 Holdings Co. Ltd. Ordinary Shares,22995847.0,China,Technology,EDP Services
BSLK,Bolt Projects Holdings Inc. Common Stock,22959661.0,United States,Industrials,Major Chemicals
NYC,American Strategic Investment Co. Class A Common Stock,22910228.0,,Real Estate,Real Estate Investment Trusts
FGFPP,Fundamental Global Inc. 8.00% Cumulative Preferred Stock,22755942.0,United States,Finance,Property-Casualty Insurers
PYPD,PolyPid Ltd. Ordinary Shares,22723617.0,Israel,Health Care,Biotechnology: Pharmaceutical Preparations
DTCK,Davis Commodities Limited Ordinary Shares,22663078.0,Singapore,Industrials,Farming/Seeds/Milling
SPRB,Spruce Biosciences Inc. Common Stock,22576001.0,United States,Health Care,Biotechnology: Pharmaceutical Preparations
NWGL,Nature Wood Group Limited American Depositary Shares,22512304.0,China,Energy,
GLYC,GlycoMimetics Inc. Common Stock,22369485.0,United States,Health Care,Biotechnology: Pharmaceutical Preparations
PTN,Palatin Technologies Inc. Common Stock,22284910.0,United States,Health Care,Biotechnology: Pharmaceutical Preparations
SUGP,SU Group Holdings Limited Ordinary Shares,22260000.0,Hong Kong,Consumer Discretionary,Diversified Commercial Services
BPT,BP Prudhoe Bay Royalty Trust Common Stock,22256000.0,United States,Energy,Integrated oil Companies
CPSH,CPS Technologies Corp. Common Stock,22224719.0,United States,Consumer Discretionary,Building Materials
FEBO,Fenbo Holdings Limited Ordinary Shares,22220000.0,Hong Kong,Consumer Discretionary,Home Furnishings
COOT,Australian Oilseeds Holdings Limited Ordinary Shares,22151148.0,Australia,Consumer Staples,Packaged Foods
CCM,Concord Medical Services Holdings Limited American Depositary Shares (Each represents thirty (30) Class A ordinary shares),22099370.0,China,Health Care,Medical/Nursing Services
INAB,IN8bio Inc. Common Stock,22085647.0,United States,Health Care,Biotechnology: Biological Products (No Diagnostic Substances)
ANGH,Anghami Inc. Ordinary Shares,22059408.0,United Arab Emirates,Consumer Discretionary,Telecommunications Equipment
SKK,SKK Holdings Limited Common Stock,22031250.0,Singapore,Industrials,Water Sewer Pipeline Comm & Power Line Construction
ABTS,Abits Group Inc Ordinary Shares,22015456.0,China,Technology,Computer Software: Programming Data Processing
PSHG,Performance Shipping Inc. Common Shares,21980620.0,Greece,Consumer Discretionary,Marine Transportation
MTVA,MetaVia Inc. Common Stock,21970826.0,United States,,
CVV,CVD Equipment Corporation Common Stock,21953063.0,United States,Technology,Industrial Machinery/Components
TALKW,Talkspace Inc. Warrant,21943070.0,United States,Health Care,Medical/Nursing Services
ERNA,Eterna Therapeutics Inc. Common Stock,21834253.0,United States,Health Care,Biotechnology: Pharmaceutical Preparations
GYRO,Gyrodyne LLC Common Stock,21813836.0,United States,Real Estate,Building operators
HWH,HWH International Inc. Common Stock,21812681.0,United States,Health Care,Other Pharmaceuticals
AEON,AEON Biopharma Inc. Class A Common Stock,21740060.0,United States,Health Care,Biotechnology: Pharmaceutical Preparations
CGBS,Crown LNG Holdings Limited Ordinary Shares,21631935.0,Jersey,Utilities,Oil/Gas Transmission
RZLVW,Rezolve AI Limited Warrants,21626156.0,United Kingdom,Technology,Computer Software: Programming Data Processing
NXGL,NexGel Inc Common Stock,21594671.0,United States,Health Care,Medical/Dental Instruments
SLDPW,Solid Power Inc. Warrant,21466133.0,United States,Miscellaneous,Industrial Machinery/Components
PIRS,Pieris Pharmaceuticals Inc. Common Stock,21460237.0,United States,Health Care,Biotechnology: Pharmaceutical Preparations
KFFB,Kentucky First Federal Bancorp Common Stock,21429795.0,United States,Finance,Savings Institutions
VNCE,Vince Holding Corp. Common Stock,21425756.0,,Consumer Discretionary,Clothing/Shoe/Accessory Stores
MIRA,MIRA Pharmaceuticals Inc. Common Stock,21363499.0,United States,Health Care,Biotechnology: Pharmaceutical Preparations
UCAR,U Power Limited Class A Ordinary Shares,21361262.0,China,Consumer Discretionary,Auto Parts:O.E.M.
SWAG,Stran & Company Inc. Common Stock,21212355.0,United States,Consumer Discretionary,Advertising
ACXP,Acurx Pharmaceuticals Inc. Common Stock,21115685.0,United States,Health Care,Biotechnology: Pharmaceutical Preparations
COCP,Cocrystal Pharma Inc. Common Stock,21013963.0,United States,Health Care,Biotechnology: Pharmaceutical Preparations
GLXG,Galaxy Payroll Group Limited Ordinary Shares,20945000.0,Hong Kong,Consumer Discretionary,Diversified Commercial Services
UBX,Unity Biotechnology Inc. Common Stock,20894434.0,United States,Health Care,Biotechnology: Pharmaceutical Preparations
NRXS,Neuraxis Inc. Common Stock,20751517.0,,Health Care,Biotechnology: Electromedical & Electrotherapeutic Apparatus
AMS,American Shared Hospital Services Common Stock,20672400.0,United States,Health Care,Medical Specialities
JZ,Jianzhi Education Technology Group Company Limited American Depositary Shs,20639163.0,China,Real Estate,Other Consumer Services
NXPL,NextPlat Corp Common Stock,20575718.0,United States,Telecommunications,Telecommunications Equipment
RMCF,Rocky Mountain Chocolate Factory Inc. Common Stock,20514111.0,United States,Consumer Staples,Specialty Foods
WHLM,Wilhelmina International Inc. Common Stock,20474656.0,United States,Consumer Discretionary,Professional Services
NVNI,Nvni Group Limited Ordinary Shares,20445077.0,Cayman Islands,Technology,Computer Software: Prepackaged Software
WKEY,WISeKey International Holding Ltd American Depositary Shares,20328000.0,Switzerland,Technology,EDP Services
WETH,Wetouch Technology Inc. Common Stock,20283608.0,China,Technology,Computer peripheral equipment
VHC,VirnetX Holding Corp Common Stock,20174550.0,United States,Miscellaneous,Multi-Sector Companies
CCTG,CCSC Technology International Holdings Limited Class A Ordinary Shares,20035563.0,Hong Kong,Consumer Discretionary,Building Products
IHT,InnSuites Hospitality Trust Shares of Beneficial Interest,19918396.0,United States,Finance,Investment Bankers/Brokers/Service
ODVWZ,Osisko Development Corp. Warrant expiring 5/27/2027,19865463.0,Canada,Basic Materials,Precious Metals
WKSP,Worksport Ltd. Common Stock,19835028.0,Canada,Consumer Discretionary,Auto Parts:O.E.M.
KAPA,Kairos Pharma Ltd. Common Stock,19784049.0,,Health Care,Biotechnology: Pharmaceutical Preparations
SKYQ,Sky Quarry Inc. Common Stock,19740631.0,United States,Industrials,Environmental Services
COHN,Cohen & Company Inc.,19696535.0,United States,Finance,Investment Bankers/Brokers/Service
CPIX,Cumberland Pharmaceuticals Inc. Common Stock,19659226.0,United States,Health Care,Biotechnology: Pharmaceutical Preparations
DNMR,Danimer Scientific Inc. Common Stock,19625392.0,United States,Industrials,Major Chemicals
ZKIN,ZK International Group Co. Ltd Ordinary Share,19519718.0,China,Industrials,Metal Fabrications
NNVC,NanoViricides Inc. Common Stock,19511920.0,United States,Health Care,Biotechnology: Pharmaceutical Preparations
BOSC,B.O.S. Better Online Solutions Common Stock,19485781.0,Israel,Telecommunications,Computer Communications Equipment
LNZAW,LanzaTech Global Inc. Warrant,19263972.0,United States,Industrials,Major Chemicals
CNTM,ConnectM Technology Solutions Inc. Common Stock,19259292.0,United States,Consumer Discretionary,Engineering & Construction
NMTC,NeuroOne Medical Technologies Corporation Common Stock,19198882.0,United States,Health Care,Medical/Dental Instruments
OXBR,Oxbridge Re Holdings Limited Ordinary Shares,19176878.0,Cayman Islands,Finance,Property-Casualty Insurers
OCC,Optical Cable Corporation Common Stock,19112300.0,United States,Industrials,Telecommunications Equipment
NRSN,NeuroSense Therapeutics Ltd. Ordinary Shares,19082547.0,Israel,Health Care,Biotechnology: Pharmaceutical Preparations
QMMM,QMMM Holdings Limited Ordinary Shares,19008750.0,Hong Kong,Consumer Discretionary,Advertising
PLAG,Planet Green Holdings Corp. Common Stock,19007884.0,China,Consumer Staples,Packaged Foods
FCUV,Focus Universal Inc. Common Stock,18958618.0,United States,Industrials,Industrial Machinery/Components
BIAF,bioAffinity Technologies Inc. Common Stock,18935332.0,United States,Health Care,Biotechnology: Commercial Physical & Biological Resarch
GELS,Gelteq Limited Ordinary Shares,18876150.0,Australia,Health Care,Biotechnology: Pharmaceutical Preparations
MEIP,MEI Pharma Inc. Common Stock,18789257.0,United States,Health Care,Biotechnology: Pharmaceutical Preparations
BFRG,Bullfrog AI Holdings Inc. Common Stock,18733277.0,United States,Health Care,Biotechnology: Pharmaceutical Preparations
MMA,Alta Global Group Limited Ordinary Shares,18712432.0,,Consumer Discretionary,Other Consumer Services
CRMLW,Critical Metals Corp. Warrants,18686707.0,British Virgin Islands,Basic Materials,Metal Mining
COSM,Cosmos Health Inc. Common Stock,18653493.0,United States,Health Care,Other Pharmaceuticals
ABVE,Above Food Ingredients Inc. Common Stock,18629087.0,Canada,Consumer Staples,Packaged Foods
HKIT,Hitek Global Inc. Class A Ordinary Share,18566150.0,China,Technology,Computer Software: Prepackaged Software
RVP,Retractable Technologies Inc. Common Stock,18561039.0,United States,Health Care,Medical/Dental Instruments
MSS,Maison Solutions Inc. Class A Common Stock,18511016.0,United States,Consumer Staples,Food Chains
CYTH,Cyclo Therapeutics Inc. Common Stock,18483475.0,United States,Health Care,Biotechnology: Biological Products (No Diagnostic Substances)
XIN,Xinyuan Real Estate Co Ltd American Depositary Shares,18469007.0,China,Consumer Discretionary,Homebuilding
WVVIP,Willamette Valley Vineyards Inc. Series A Redeemable Preferred Stock,18468048.0,United States,Consumer Staples,Beverages (Production/Distribution)
PRPH,ProPhase Labs Inc. Common Stock (DE),18428363.0,United States,Health Care,Biotechnology: Pharmaceutical Preparations
ILAG,Intelligent Living Application Group Inc. Ordinary Shares,18419394.0,Hong Kong,Consumer Discretionary,Office Equipment/Supplies/Services
LSH,Lakeside Holding Limited Common Stock,18375000.0,United States,,
BRN,Barnwell Industries Inc. Common Stock,18351405.0,United States,Energy,Oil & Gas Production
USEA,United Maritime Corporation Common Stock,18295286.0,Greece,Consumer Discretionary,Marine Transportation
TENX,Tenax Therapeutics Inc. Common Stock,18271736.0,United States,Health Care,Biotechnology: Pharmaceutical Preparations
LFWD,Lifeward Ltd. Ordinary Shares,18232856.0,Israel,Health Care,Industrial Specialties
MOGU,MOGU Inc. American Depositary Shares (each  representing 25 Class A Ordinary Shares),18198464.0,,Consumer Discretionary,Business Services
PALT,Paltalk Inc. Common Stock,18196864.0,United States,Consumer Discretionary,Business Services
HUSA,Houston American Energy Corporation Common Stock,18190281.0,United States,Energy,Oil & Gas Production
DRTSW,Alpha Tau Medical Ltd. Warrant,18114359.0,Israel,Health Care,Medical/Dental Instruments
MRNS,Marinus Pharmaceuticals Inc. Common Stock,17913253.0,United States,Health Care,Biotechnology: Pharmaceutical Preparations
SOHO,Sotherly Hotels Inc. Common Stock,17866233.0,United States,Real Estate,Real Estate Investment Trusts
UGRO,urban-gro Inc. Common Stock,17862203.0,United States,Consumer Discretionary,Industrial Specialties
HCWB,HCW Biologics Inc. Common Stock,17852642.0,United States,Health Care,Biotechnology: Pharmaceutical Preparations
DTSS,Datasea Inc. Common Stock,17717505.0,China,Technology,Computer Software: Prepackaged Software
SPPL,SIMPPLE LTD. Ordinary Shares,17686297.0,Singapore,Consumer Discretionary,Diversified Commercial Services
DRCT,Direct Digital Holdings Inc. Class A Common Stock,17601481.0,United States,Consumer Discretionary,Advertising
JFU,9F Inc. American Depositary Shares,17542266.0,China,Finance,Finance: Consumer Services
CASK,Heritage Distilling Holding Company Inc. Common Stock,17521577.0,United States,Consumer Staples,Beverages (Production/Distribution)
BTAI,BioXcel Therapeutics Inc. Common Stock,17471256.0,United States,Health Care,Biotechnology: Pharmaceutical Preparations
GLBZ,Glen Burnie Bancorp Common Stock,17404086.0,United States,Finance,Major Banks
YHGJ,Yunhong Green CTI Ltd. Common Stock,17398415.0,United States,Industrials,Specialty Chemicals
CPOP,Pop Culture Group Co. Ltd Class A Ordinary Shares,17329288.0,China,Consumer Discretionary,Services-Misc. Amusement & Recreation
MGIH,Millennium Group International Holdings Limited Ordinary Shares,17325000.0,Hong Kong,Consumer Discretionary,Publishing
LIQT,LiqTech International Inc. Common Stock,17292404.0,Denmark,Technology,Industrial Machinery/Components
RMSG,Real Messenger Corporation Ordinary Shares,17244401.0,United States,Technology,Computer Software: Programming Data Processing
KZIA,Kazia Therapeutics Limited American Depositary Shares,17208386.0,Australia,Health Care,Biotechnology: Pharmaceutical Preparations
SGMA,SigmaTron International Inc. Common Stock,17134006.0,United States,Technology,Electrical Products
SEED,Origin Agritech Limited Common Stock,17104495.0,China,Consumer Staples,Farming/Seeds/Milling
TURB,Turbo Energy S.A. American Depositary Shares,17076567.0,Spain,Miscellaneous,Industrial Machinery/Components
AQMS,Aqua Metals Inc. Common Stock,17044969.0,United States,Industrials,Metal Fabrications
JDZG,JIADE LIMITED Common stock,17013301.0,China,Real Estate,Other Consumer Services
DMN,Damon Inc. Common Stock,16946370.0,United Kingdom,Technology,EDP Services
HUBC,Hub Cyber Security Ltd. Ordinary Shares,16819866.0,Israel,Telecommunications,Computer Communications Equipment
ORGNW,Origin Materials Inc. Warrants,16818769.0,United States,Industrials,Major Chemicals
NXTT,Next Technology Holding Inc. Ordinary Shares,16813148.0,China,Technology,EDP Services
WVVI,Willamette Valley Vineyards Inc. Common Stock,16719044.0,United States,Consumer Staples,Beverages (Production/Distribution)
CGTX,Cognition Therapeutics Inc. Common Stock,16702294.0,United States,Health Care,Biotechnology: Biological Products (No Diagnostic Substances)
CARA,Cara Therapeutics Inc. Common Stock,16676076.0,United States,Health Care,Biotechnology: Pharmaceutical Preparations
RNWWW,ReNew Energy Global plc Warrant,16675810.0,United Kingdom,Utilities,Electric Utilities: Central
NTRBW,Nutriband Inc. Warrant,16644278.0,United States,Health Care,Industrial Specialties
HOVR,New Horizon Aircraft Ltd. Class A Ordinary Share,16585159.0,United States,Industrials,Aerospace
WHLRD,Wheeler Real Estate Investment Trust Inc. Series D Cumulative Preferred Stock,16567168.0,United States,Real Estate,Real Estate Investment Trusts
MRM,MEDIROM Healthcare Technologies Inc. American Depositary Share,16551675.0,Japan,Consumer Discretionary,Other Consumer Services
SYBX,Synlogic Inc. Common Stock,16549994.0,United States,Health Care,Biotechnology: Pharmaceutical Preparations
MTEK,Maris-Tech Ltd. Ordinary Shares,16544852.0,Israel,Telecommunications,Telecommunications Equipment
GORO,Gold Resource Corporation Common Stock,16510281.0,United States,Basic Materials,Precious Metals
MBOT,Microbot Medical Inc. Common Stock,16495487.0,Israel,Health Care,Biotechnology: Biological Products (No Diagnostic Substances)
VVOS,Vivos Therapeutics Inc. Common Stock,16488373.0,United States,Health Care,Medical/Dental Instruments
CVR,Chicago Rivet & Machine Co. Common Stock,16462889.0,United States,Industrials,Industrial Machinery/Components
GIGM,GigaMedia Limited Ordinary Shares,16357308.0,Taiwan,Technology,Computer Software: Programming Data Processing
NEPH,Nephros Inc. Common Stock,16343549.0,United States,Health Care,Medical/Dental Instruments
CISO,CISO Global Inc. Common Stock,16314175.0,United States,Consumer Discretionary,Professional Services
EQS,Equus Total Return Inc. Common Stock,16304766.0,United States,Finance,Finance/Investors Services
LUCY,Innovative Eyewear Inc. Common Stock,16299563.0,United States,Health Care,Ophthalmic Goods
TAIT,Taitron Components Incorporated Class A Common Stock,16257788.0,United States,Technology,Electronic Components
XELB,Xcel Brands Inc. Common Stock,16154097.0,United States,Miscellaneous,Multi-Sector Companies
SONM,Sonim Technologies Inc. Common Stock,16125125.0,United States,Utilities,Telecommunications Equipment
SANW,S&W Seed Company Common Stock (NV),16105514.0,United States,Consumer Staples,Farming/Seeds/Milling
HCWC,Healthy Choice Wellness Corp. Class A Common Stock,16097828.0,,Consumer Staples,Food Chains
LVROW,Lavoro Limited Warrant,16033645.0,Brazil,Consumer Discretionary,Other Specialty Stores
GNS,Genius Group Limited Ordinary Shares,16029903.0,Singapore,Consumer Discretionary,Services-Misc. Amusement & Recreation
DPRO,Draganfly Inc. Common Shares,16027622.0,Canada,Industrials,Aerospace
LOBO,LOBO EV TECHNOLOGIES LTD. Ordinary shares,16026800.0,China,Consumer Discretionary,Motor Vehicles
MTEX,Mannatech Incorporated Common Stock,16020919.0,United States,Health Care, Medicinal Chemicals and Botanical Products 
IDAI,T Stamp Inc. Class A Common Stock,15970174.0,United States,Technology,Computer Software: Prepackaged Software
EDTK,Skillful Craftsman Education Technology Limited Ordinary Share,15929451.0,China,Real Estate,Other Consumer Services
BBGI,Beasley Broadcast Group Inc. Class A Common Stock,15883898.0,United States,Consumer Discretionary,Broadcasting
NRXP,NRX Pharmaceuticals Inc. Common Stock,15843263.0,United States,Health Care,Biotechnology: Pharmaceutical Preparations
INVZW,Innoviz Technologies Ltd. Warrant,15794468.0,Israel,Consumer Discretionary,Auto Parts:O.E.M.
NERV,Minerva Neurosciences Inc Common Stock,15770131.0,United States,Health Care,Biotechnology: Pharmaceutical Preparations
APRE,Aprea Therapeutics Inc. Common stock,15761219.0,United States,Health Care,Biotechnology: Pharmaceutical Preparations
EDUC,Educational Development Corporation Common Stock,15717202.0,United States,Consumer Discretionary,Consumer Specialties
AKTS,Akoustis Technologies Inc. Common Stock,15629142.0,United States,Utilities,Telecommunications Equipment
AIRI,Air Industries Group Common Stock,15615253.0,United States,Industrials,Military/Government/Technical
SLGL,Sol-Gel Technologies Ltd. Ordinary Shares,15614196.0,Israel,Health Care,Biotechnology: Pharmaceutical Preparations
MNTS,Momentus Inc. Class A Common Stock,15485156.0,United States,Industrials,Military/Government/Technical
BCTXW,BriaCell Therapeutics Corp. Warrant,15482086.0,Canada,Health Care,Biotechnology: Pharmaceutical Preparations
EZFL,EzFill Holdings Inc. Common Stock,15402724.0,United States,Consumer Discretionary,Retail-Auto Dealers and Gas Stations
RMCO,Royalty Management Holding Corporation Class A Common Stock,15380906.0,United States,Miscellaneous,Multi-Sector Companies
AILEW,iLearningEngines Inc. Warrant,15373770.0,United States,Technology,Computer Software: Prepackaged Software
PT,Pintec Technology Holdings Limited American Depositary Shares,15310043.0,China,Technology,Computer Software: Programming Data Processing
HLP,Hongli Group Inc. Ordinary Shares,15298438.0,China,Industrials,Industrial Machinery/Components
EKSO,Ekso Bionics Holdings Inc. Common Stock,15288866.0,United States,Industrials,Industrial Machinery/Components
SMSI,Smith Micro Software Inc. Common Stock,15253569.0,United States,Technology,Computer Software: Prepackaged Software
GORV,Lazydays Holdings Inc. Common Stock,15184009.0,United States,Consumer Discretionary,Retail-Auto Dealers and Gas Stations
LOCL,Local Bounti Corporation Common Stock,15147421.0,,Consumer Staples,Farming/Seeds/Milling
JCTC,Jewett-Cameron Trading Company Common Shares,15000553.0,United States,Consumer Discretionary,RETAIL: Building Materials
MMV,MultiMetaVerse Holdings Limited Class A Ordinary Share,14971158.0,Hong Kong,Technology,Computer Software: Prepackaged Software
YQ,17 Education & Technology Group Inc. American Depositary Shares,14874428.0,China,Real Estate,Other Consumer Services
TOMZ,TOMI Environmental Solutions Inc. Common Stock,14835270.0,United States,Industrials,Major Chemicals
AWH,Aspira Women's Health Inc. Common Stock,14833857.0,United States,Health Care,Biotechnology: In Vitro & In Vivo Diagnostic Substances
RAYA,Erayak Power Solution Group Inc. Class A Ordinary Shares,14814255.0,China,Consumer Discretionary,Metal Fabrications
ELSE,Electro-Sensors Inc. Common Stock,14774771.0,United States,Industrials,Industrial Machinery/Components
AIM,AIM ImmunoTech Inc. Common Stock,14658853.0,United States,Health Care,Biotechnology: Biological Products (No Diagnostic Substances)
PMNT,Perfect Moment Ltd. Common Stock,14613363.0,United Kingdom,,
PSIG,PS International Group Ltd. Ordinary Shares,14569762.0,Hong Kong,Consumer Discretionary,Oil Refining/Marketing
GMM,Global Mofy AI Limited Class A Ordinary Shares,14568875.0,China,Technology,Computer Software: Programming Data Processing
SAIH,SAIHEAT Limited Class A Ordinary Shares,14413299.0,Singapore,Technology,EDP Services
TKLF,Tokyo Lifestyle Co. Ltd. American Depositary Shares,14312651.0,Japan,Consumer Discretionary,Other Specialty Stores
SYNX,Silynxcom Ltd. Ordinary Shares,14175000.0,,Consumer Staples,Consumer Electronics/Appliances
NKGN,NKGen Biotech Inc. Common Stock,14144950.0,United States,Health Care,Biotechnology: Biological Products (No Diagnostic Substances)
MKDW,MKDWELL Tech Inc. Ordinary Share,14100528.0,Taiwan,Technology,Consumer Electronics/Appliances
ARBEW,Arbe Robotics Ltd. Warrant,14079880.0,Israel,Technology,EDP Services
NCRA,Nocera Inc. Common Stock,14016987.0,Taiwan,Consumer Staples,Farming/Seeds/Milling
CING,Cingulate Inc. Common Stock,14005336.0,United States,Health Care,Biotechnology: Pharmaceutical Preparations
TRAW,Traws Pharma Inc. Common Stock,13857037.0,United States,Health Care,Biotechnology: Pharmaceutical Preparations
PRZO,ParaZero Technologies Ltd. Ordinary Shares,13838400.0,Israel,Industrials,Military/Government/Technical
PMD,Psychemedics Corporation,13704622.0,United States,Health Care,Medical Specialities
MDRR,Medalist Diversified REIT Inc. Common Stock,13665281.0,United States,Real Estate,Real Estate Investment Trusts
SNSE,Sensei Biotherapeutics Inc. Common Stock,13611926.0,United States,Health Care,Biotechnology: Pharmaceutical Preparations
MTR,Mesa Royalty Trust Common Stock,13604207.0,United States,Energy,Oil & Gas Production
BOF,BranchOut Food Inc. Common Stock,13586039.0,United States,Consumer Staples,Packaged Foods
WALDW,Waldencast plc Warrant ,13562995.0,United States,Consumer Discretionary,Package Goods/Cosmetics
LYRA,Lyra Therapeutics Inc. Common Stock,13562825.0,United States,Health Care,Medical/Dental Instruments
VCIG,VCI Global Limited Ordinary Share,13562317.0,Malaysia,Consumer Discretionary,Diversified Commercial Services
ARBB,ARB IOT Group Limited Ordinary Shares,13483125.0,Malaysia,Technology,EDP Services
CNFR,Conifer Holdings Inc. Common Stock,13476949.0,United States,Finance,Property-Casualty Insurers
MHUA,Meihua International Medical Technologies Co. Ltd. Ordinary Shares,13445426.0,China,Health Care,Medical/Dental Instruments
CJJD,China Jo-Jo Drugstores Inc. (Cayman Islands) Ordinary Shares,13402642.0,China,Consumer Staples,Retail-Drug Stores and Proprietary Stores
KUKE,Kuke Music Holding Limited American Depositary Shares each representing one Ordinary Share,13300689.0,,Real Estate,Other Consumer Services
APCX,AppTech Payments Corp. Common Stock,13270169.0,United States,Technology,Computer Software: Prepackaged Software
CMLS,Cumulus Media Inc. Class A Common Stock,13197860.0,United States,Consumer Discretionary,Broadcasting
NWTNW,NWTN Inc. Warrant,13193153.0,United Arab Emirates,Consumer Discretionary,Auto Manufacturing
SSKN,Strata Skin Sciences Inc. Common Stock,13139157.0,United States,Health Care,Medical/Dental Instruments
PMCB,PharmaCyte  Biotech Inc. Common Stock,13131935.0,United States,Health Care,Biotechnology: Biological Products (No Diagnostic Substances)
LRHC,La Rosa Holdings Corp. Common Stock,13130579.0,United States,Finance,Real Estate
MI,NFT Limited Class A Ordinary Share,13109668.0,,Consumer Discretionary,Other Specialty Stores
AISPW,Airship AI Holdings Inc. Warrants,13096567.0,United States,Technology,Computer Software: Prepackaged Software
MRNOW,Murano Global Investments PLC Warrants,13082998.0,Mexico,Consumer Discretionary,Hotels/Resorts
JBDI,JBDI Holdings Limited Ordinary Shares,13028090.0,Singapore,,
PC,Premium Catering (Holdings) Limited Ordinary Shares,12928000.0,Singapore,Consumer Discretionary,Restaurants
ADN,Advent Technologies Holdings Inc. Class A Common Stock,12918889.0,United States,Miscellaneous,Industrial Machinery/Components
PHGE,BiomX Inc. COmmon Stock,12909023.0,,Health Care,Biotechnology: Biological Products (No Diagnostic Substances)
EEIQ,EpicQuest Education Group International Limited Common Stock,12894100.0,United States,Real Estate,Other Consumer Services
HRYU,Hanryu Holdings Inc. Common Stock,12874734.0,South Korea,Technology,Computer Software: Programming Data Processing
RVYL,Ryvyl Inc. Common Stock,12793658.0,United States,Consumer Discretionary,Professional Services
GFAI,Guardforce AI Co. Limited Ordinary Shares,12779485.0,Singapore,Consumer Discretionary,Diversified Commercial Services
PEV,Phoenix Motor Inc. Common Stock,12759074.0,United States,Consumer Discretionary,Construction/Ag Equipment/Trucks
WISA,WiSA Technologies Inc. Common Stock,12739238.0,United States,Technology,Semiconductors
VRAR,The Glimpse Group Inc. Common Stock,12723769.0,United States,Technology,EDP Services
