Symbol,Name,Market Cap,Country,Sector,Industry
AAPL,Apple Inc. Common Stock,3587438272590.0,United States,Technology,Computer Manufacturing
NVDA,NVIDIA Corporation Common Stock,3385742500000.0,United States,Technology,Semiconductors
MSFT,Microsoft Corporation Common Stock,3148374613405.0,United States,Technology,Computer Software: Prepackaged Software
AMZN,Amazon.com Inc. Common Stock,2185965638453.0,United States,Consumer Discretionary,Catalog/Specialty Distribution
GOOG,Alphabet Inc. Class C Capital Stock,2086968090000.0,United States,Technology,Computer Software: Programming Data Processing
GOOGL,Alphabet Inc. Class A Common Stock,2068116950000.0,United States,Technology,Computer Software: Programming Data Processing
META,Meta Platforms Inc. Class A Common Stock,1449864254273.0,United States,Technology,Computer Software: Programming Data Processing
TSLA,Tesla Inc. Common Stock,1107984191900.0,United States,Consumer Discretionary,Auto Manufacturing
BRK/B,Berkshire Hathaway Inc.,1065692518420.0,United States,,
BRK/A,Berkshire Hathaway Inc.,1064971610960.0,United States,,
TSM,Taiwan Semiconductor Manufacturing Company Ltd.,957723245803.0,Taiwan,Technology,Semiconductors
AVGO,Broadcom Inc. Common Stock,757006971533.0,United States,Technology,Semiconductors
LLY,Eli Lilly and Company Common Stock,755038237223.0,United States,Health Care,Biotechnology: Pharmaceutical Preparations
WMT,Walmart Inc. Common Stock,743538233595.0,United States,Consumer Discretionary,Department/Specialty Retail Stores
JPM,JP Morgan Chase & Co. Common Stock,703046810182.0,United States,Finance,Major Banks
V,Visa Inc.,586954695015.0,United States,Consumer Discretionary,Business Services
UNH,UnitedHealth Group Incorporated Common Stock (DE),561557500607.0,United States,Health Care,Medical Specialities
XOM,Exxon Mobil Corporation Common Stock,518445351467.0,United States,Energy,Integrated oil Companies
ORCL,Oracle Corporation Common Stock,512185725120.0,United States,Technology,Computer Software: Prepackaged Software
MA,Mastercard Incorporated Common Stock,489148868062.0,United States,Consumer Discretionary,Business Services
NVO,Novo Nordisk A/S Common Stock,476566088492.0,Denmark,Health Care,Biotechnology: Pharmaceutical Preparations
COST,Costco Wholesale Corporation Common Stock,430614309140.0,United States,Consumer Discretionary,Department/Specialty Retail Stores
HD,Home Depot Inc. (The) Common Stock,426281697688.0,United States,Consumer Discretionary,RETAIL: Building Materials
PG,Procter & Gamble Company (The) Common Stock,422164780341.0,United States,Consumer Discretionary,Package Goods/Cosmetics
NFLX,Netflix Inc. Common Stock,379074130076.0,United States,Consumer Discretionary,Consumer Electronics/Video Chains
JNJ,Johnson & Johnson Common Stock,373205636890.0,United States,Health Care,Biotechnology: Pharmaceutical Preparations
BAC,Bank of America Corporation Common Stock,364538509748.0,United States,Finance,Major Banks
ABBV,AbbVie Inc. Common Stock,323262979286.0,United States,Health Care,Biotechnology: Pharmaceutical Preparations
CRM,Salesforce Inc. Common Stock,315470440000.0,United States,Technology,Computer Software: Prepackaged Software
CVX,Chevron Corporation Common Stock,291002998257.0,United States,Energy,Integrated oil Companies
SMFG,Sumitomo Mitsui Financial Group Inc Unsponsored American Depositary Shares (Japan),290654024598.0,Japan,Finance,Commercial Banks
TMUS,T-Mobile US Inc. Common Stock,286570572857.0,United States,Telecommunications,Telecommunications Equipment
SAP,SAP  SE ADS,277333623706.0,Germany,Technology,Computer Software: Prepackaged Software
KO,Coca-Cola Company (The) Common Stock,276043640603.0,United States,Consumer Staples,Beverages (Production/Distribution)
ASML,ASML Holding N.V. New York Registry Shares,270127287856.0,Netherlands,Technology,Industrial Machinery/Components
MRK,Merck & Company Inc. Common Stock (new),257112166958.0,United States,Health Care,Biotechnology: Pharmaceutical Preparations
WFC,Wells Fargo & Company Common Stock,253607303496.0,United States,Finance,Major Banks
CSCO,Cisco Systems Inc. Common Stock (DE),235819116575.0,United States,Telecommunications,Computer Communications Equipment
CCZ,Comcast Holdings ZONES,230485897271.0,United States,Telecommunications,Cable & Other Pay Television Services
TM,Toyota Motor Corporation Common Stock,229909797348.0,Japan,Consumer Discretionary,Auto Manufacturing
ADBE,Adobe Inc. Common Stock,227112386000.0,United States,Technology,Computer Software: Prepackaged Software
ACN,Accenture plc Class A Ordinary Shares (Ireland),226540461983.0,Ireland,Consumer Discretionary,Business Services
PEP,PepsiCo Inc. Common Stock,224251606136.0,United States,Consumer Staples,Beverages (Production/Distribution)
AMD,Advanced Micro Devices Inc. Common Stock,222608597688.0,United States,Technology,Semiconductors
LIN,Linde plc Ordinary Shares,219504031704.0,United States,Industrials,Major Chemicals
NVS,Novartis AG Common Stock,216197474699.0,Switzerland,Health Care,Biotechnology: Pharmaceutical Preparations
NOW,ServiceNow Inc. Common Stock,216184640000.0,United States,Technology,Computer Software: Prepackaged Software
AXP,American Express Company Common Stock,214630269085.0,United States,Finance,Finance: Consumer Services
DIS,Walt Disney Company (The) Common Stock,212731040276.0,United States,Consumer Discretionary,Services-Misc. Amusement & Recreation
BABA,Alibaba Group Holding Limited American Depositary Shares each representing eight Ordinary share,212627202812.0,China,Consumer Discretionary,Business Services
MCD,McDonald's Corporation Common Stock,212126593253.0,United States,Consumer Discretionary,Restaurants
MS,Morgan Stanley Common Stock,212028392552.0,United States,Finance,Investment Bankers/Brokers/Service
IBM,International Business Machines Corporation Common Stock,210273554016.0,United States,Technology,Computer Manufacturing
AZN,AstraZeneca PLC American Depositary Shares,209661849548.0,United Kingdom,Health Care,Biotechnology: Pharmaceutical Preparations
PM,Philip Morris International Inc Common Stock,206886133535.0,United States,Health Care, Medicinal Chemicals and Botanical Products 
ABT,Abbott Laboratories Common Stock,206001245648.0,United States,Health Care,Biotechnology: Pharmaceutical Preparations
TMO,Thermo Fisher Scientific Inc Common Stock,202583615352.0,United States,Industrials,Industrial Machinery/Components
SHEL,Shell PLC American Depositary Shares (each representing two (2) Ordinary Shares) ,201479906310.0,Netherlands,Energy,Oil & Gas Production
GE,GE Aerospace Common Stock,197150675769.0,United States,Technology,Consumer Electronics/Appliances
CAT,Caterpillar Inc. Common Stock,196070918402.0,United States,Industrials,Construction/Ag Equipment/Trucks
ISRG,Intuitive Surgical Inc. Common Stock,193049259190.0,United States,Health Care,Industrial Specialties
GS,Goldman Sachs Group Inc. (The) Common Stock,191036099766.0,United States,Finance,Investment Bankers/Brokers/Service
VZ,Verizon Communications Inc. Common Stock,186654828812.0,United States,Telecommunications,Telecommunications Equipment
TXN,Texas Instruments Incorporated Common Stock,183382905912.0,United States,Technology,Semiconductors
TBC,AT&T Inc. 5.625% Global Notes due 2067,180386769407.0,United States,Telecommunications,Telecommunications Equipment
INTU,Intuit Inc. Common Stock,179706860550.0,United States,Technology,Computer Software: Prepackaged Software
RY,Royal Bank Of Canada Common Stock,177754661140.0,Canada,Finance,Commercial Banks
QCOM,QUALCOMM Incorporated Common Stock,176126830000.0,United States,Technology,Radio And Television Broadcasting And Communications Equipment
DHR,Danaher Corporation Common Stock,173122128546.0,United States,Industrials,Industrial Machinery/Components
BKNG,Booking Holdings Inc. Common Stock,172168439092.0,United States,Consumer Discretionary,Transportation Services
HSBC,HSBC Holdings plc. Common Stock,171471327944.0,United Kingdom,Finance,Savings Institutions
TBB,AT&T Inc. 5.350% Global Notes due 2066,169336824105.0,United States,Telecommunications,Telecommunications Equipment
HDB,HDFC Bank Limited Common Stock,169056585265.0,India,Finance,Commercial Banks
T,AT&T Inc.,166179696876.0,United States,Telecommunications,Telecommunications Equipment
LYG,Lloyds Banking Group Plc American Depositary Shares,166002758440.0,United Kingdom,Finance,Commercial Banks
CMCSA,Comcast Corporation Class A Common Stock,165268262730.0,United States,Telecommunications,Cable & Other Pay Television Services
RTX,RTX Corporation Common Stock,162157727647.0,United States,Industrials,Aerospace
SPGI,S&P Global Inc. Common Stock,162134853000.0,United States,Finance,Finance: Consumer Services
NEE,NextEra Energy Inc. Common Stock,161777345162.0,United States,Technology,EDP Services
FMX,Fomento Economico Mexicano S.A.B. de C.V. Common Stock,160008100000.0,Mexico,Consumer Staples,Beverages (Production/Distribution)
BLK,BlackRock Inc. Common Stock,158410169604.0,United States,Finance,Investment Bankers/Brokers/Service
PGR,Progressive Corporation (The) Common Stock,157512996927.0,United States,Finance,Property-Casualty Insurers
LOW,Lowe's Companies Inc. Common Stock,154547950461.0,United States,Consumer Discretionary,RETAIL: Building Materials
PLTR,Palantir Technologies Inc. Class A Common Stock,152742233280.0,United States,Technology,Computer Software: Prepackaged Software
AMGN,Amgen Inc. Common Stock,152051881355.0,United States,Health Care,Biotechnology: Biological Products (No Diagnostic Substances)
UBER,Uber Technologies Inc. Common Stock,151526843027.0,United States,Consumer Discretionary,Business Services
SCHW,Charles Schwab Corporation (The) Common Stock,151496796601.0,United States,Finance,Investment Bankers/Brokers/Service
HON,Honeywell International Inc. Common Stock,151462122223.0,United States,Industrials,Aerospace
SYK,Stryker Corporation Common Stock,149493765382.0,United States,Health Care,Medical/Dental Instruments
SHOP,Shopify Inc. Class A Subordinate Voting Shares,149168679862.0,Canada,Technology,Computer Software: Prepackaged Software
UL,Unilever PLC Common Stock,148829205687.0,United Kingdom,Consumer Discretionary,Package Goods/Cosmetics
PFE,Pfizer Inc. Common Stock,148531808817.0,United States,Health Care,Biotechnology: Pharmaceutical Preparations
ETN,Eaton Corporation PLC Ordinary Shares,148365984000.0,Ireland,Technology,Industrial Machinery/Components
UNP,Union Pacific Corporation Common Stock,148326746362.0,United States,Industrials,Railroads
KKR,KKR & Co. Inc. Common Stock,144665842409.0,United States,Finance,Investment Managers
AMAT,Applied Materials Inc. Common Stock,144031638214.0,United States,Technology,Semiconductors
TJX,TJX Companies Inc. (The) Common Stock,141762337888.0,United States,Consumer Discretionary,Clothing/Shoe/Accessory Stores
ARM,Arm Holdings plc American Depositary Shares,139705982442.0,United Kingdom,Technology,Semiconductors
MUFG,Mitsubishi UFJ Financial Group Inc. Common Stock,139671292304.0,Japan,Finance,Commercial Banks
BX,Blackstone Inc. Common Stock,137967495752.0,United States,Finance,Investment Managers
C,Citigroup Inc. Common Stock,134033936589.0,United States,Finance,Major Banks
BSX,Boston Scientific Corporation Common Stock,133617199790.0,United States,Health Care,Medical/Dental Instruments
BHP,BHP Group Limited American Depositary Shares (Each representing two Ordinary Shares),133474940516.0,Australia,Energy,Coal Mining
TTE,TotalEnergies SE,133468095969.0,France,Energy,Oil & Gas Production
PDD,PDD Holdings Inc. American Depositary Shares,132854276313.0,China,Consumer Discretionary,Business Services
ANET,Arista Networks Inc. Common Stock,127808903319.0,United States,Telecommunications,Computer Communications Equipment
DE,Deere & Company Common Stock,127470155206.0,United States,Industrials,Industrial Machinery/Components
PANW,Palo Alto Networks Inc. Common Stock,127243742000.0,United States,Technology,Computer peripheral equipment
FI,Fiserv Inc. Common Stock,125708283686.0,United States,Consumer Discretionary,Business Services
LMT,Lockheed Martin Corporation Common Stock,125488843879.0,United States,Industrials,Military/Government/Technical
ADP,Automatic Data Processing Inc. Common Stock,125060746624.0,United States,Technology,EDP Services
COP,ConocoPhillips Common Stock,124689857867.0,United States,Energy,Integrated oil Companies
SNY,Sanofi ADS,122660300994.0,France,Health Care,Biotechnology: Pharmaceutical Preparations
SONY,Sony Group Corporation American Depositary Shares ,121603386240.0,Japan,Consumer Staples,Consumer Electronics/Appliances
VRTX,Vertex Pharmaceuticals Incorporated Common Stock,120557186528.0,United States,Health Care,Biotechnology: Pharmaceutical Preparations
BMY,Bristol-Myers Squibb Company Common Stock,120108622634.0,United States,Health Care,Biotechnology: Pharmaceutical Preparations
NKE,Nike Inc. Common Stock,117248809125.0,United States,Consumer Discretionary,Shoe Manufacturing
CB,Chubb Limited  Common Stock,116386484674.0,Switzerland,Finance,Property-Casualty Insurers
SBUX,Starbucks Corporation Common Stock,116169148000.0,United States,Consumer Discretionary,Restaurants
UPS,United Parcel Service Inc. Common Stock,115819316412.0,United States,Industrials,Trucking Freight/Courier Services
GILD,Gilead Sciences Inc. Common Stock,115379293041.0,United States,Health Care,Biotechnology: Biological Products (No Diagnostic Substances)
MMC,Marsh & McLennan Companies Inc. Common Stock,114544274675.0,United States,Finance,Specialty Insurers
BA,Boeing Company (The) Common Stock,113517172157.0,United States,Industrials,Aerospace
APP,Applovin Corporation Class A Common Stock,113010539997.0,United States,Technology,Computer Software: Programming Data Processing
UBS,UBS Group AG Registered Ordinary Shares,111896400000.0,Switzerland,Finance,Major Banks
MDT,Medtronic plc. Ordinary Shares,110969002834.0,United States,Health Care,Biotechnology: Electromedical & Electrotherapeutic Apparatus
MU,Micron Technology Inc. Common Stock,108601345702.0,United States,Technology,Semiconductors
ADI,Analog Devices Inc. Common Stock,108217529015.0,United States,Technology,Semiconductors
PLD,Prologis Inc. Common Stock,108158716500.0,United States,Real Estate,Real Estate Investment Trusts
IBN,ICICI Bank Limited Common Stock,107477777749.0,India,Finance,Commercial Banks
RACE,Ferrari N.V. Common Shares,105826917662.0,Italy,Consumer Discretionary,Auto Manufacturing
INTC,Intel Corporation Common Stock,103727650000.0,United States,Technology,Semiconductors
MELI,MercadoLibre Inc. Common Stock,100642907929.0,Argentina,Consumer Discretionary,Business Services
SHW,Sherwin-Williams Company (The) Common Stock,100086497843.0,United States,Consumer Discretionary,RETAIL: Building Materials
APO,Apollo Global Management Inc. (New) Common Stock,99034854294.0,United States,Finance,Investment Managers
TD,Toronto Dominion Bank (The) Common Stock,98831399000.0,Canada,Finance,Commercial Banks
MO,Altria Group Inc.,97858501581.0,United States,Health Care, Medicinal Chemicals and Botanical Products 
AMT,American Tower Corporation (REIT) Common Stock,97663484391.0,United States,Real Estate,Real Estate Investment Trusts
SO,Southern Company (The) Common Stock,97658330963.0,United States,Utilities,Electric Utilities: Central
LRCX,Lam Research Corporation Common Stock,95060287800.0,United States,Technology,Industrial Machinery/Components
EQIX,Equinix Inc. Common Stock REIT,94701225777.0,United States,Real Estate,Real Estate Investment Trusts
ELV,Elevance Health Inc. Common Stock,94383308792.0,United States,Health Care,Medical Specialities
SPOT,Spotify Technology S.A. Ordinary Shares,94029510817.0,Luxembourg,Consumer Discretionary,Broadcasting
CI,The Cigna Group Common Stock,93959950307.0,United States,Health Care,Medical Specialities
TT,Trane Technologies plc,93659432258.0,Ireland,Industrials,Auto Parts:O.E.M.
BUD,Anheuser-Busch Inbev SA Sponsored ADR (Belgium),93461212749.0,Belgium,Consumer Staples,Beverages (Production/Distribution)
BN,Brookfield Corporation Class A Limited Voting Shares,92563655620.0,Canada,Real Estate,Building operators
ICE,Intercontinental Exchange Inc. Common Stock,92419448957.0,United States,Finance,Investment Bankers/Brokers/Service
PBR,Petroleo Brasileiro S.A.- Petrobras Common Stock,92392580051.0,Brazil,Energy,Oil & Gas Production
ENB,Enbridge Inc Common Stock,92229816909.0,Canada,Energy,Natural Gas Distribution
GEV,GE Vernova Inc. Common Stock,92101170336.0,United States,,
INFY,Infosys Limited American Depositary Shares,91632329161.0,India,Technology,EDP Services
WM,Waste Management Inc. Common Stock,91599643767.0,United States,Utilities,Environmental Services
CTAS,Cintas Corporation Common Stock,91060798345.0,United States,Consumer Discretionary,Apparel
MCO,Moody's Corporation Common Stock,91046358000.0,United States,Finance,Finance: Consumer Services
PH,Parker-Hannifin Corporation Common Stock,90477592356.0,United States,Industrials,Metal Fabrications
DUK,Duke Energy Corporation (Holding Company) Common Stock,90419065505.0,United States,Utilities,Power Generation
DELL,Dell Technologies Inc. Class C Common Stock ,89617268466.0,United States,Technology,Computer Manufacturing
RELX,RELX PLC PLC American Depositary Shares (Each representing One Ordinary Share),87765251140.0,United Kingdom,Consumer Discretionary,Business Services
APH,Amphenol Corporation Common Stock,87587777839.0,United States,Technology,Electrical Products
PYPL,PayPal Holdings Inc. Common Stock,86990294106.0,United States,Consumer Discretionary,Business Services
MDLZ,Mondelez International Inc. Class A Common Stock,86850766797.0,United States,Consumer Staples,Packaged Foods
KLAC,KLA Corporation Common Stock,86546589159.0,United States,Technology,Electronic Components
ABNB,Airbnb Inc. Class A Common Stock,86289879920.0,United States,Finance,Diversified Commercial Services
WELL,Welltower Inc. Common Stock,86043238288.0,United States,Real Estate,Real Estate Investment Trusts
SNPS,Synopsys Inc. Common Stock,85791739887.0,United States,Technology,Computer Software: Prepackaged Software
CME,CME Group Inc. Class A Common Stock,85766203838.0,United States,Finance,Investment Bankers/Brokers/Service
PNC,PNC Financial Services Group Inc. (The) Common Stock,85197337660.0,United States,Finance,Major Banks
CRWD,CrowdStrike Holdings Inc. Class A Common Stock,84806387527.0,United States,Technology,Computer Software: Prepackaged Software
AON,Aon plc Class A Ordinary Shares (Ireland),84676898488.0,United States,Finance,Specialty Insurers
CDNS,Cadence Design Systems Inc. Common Stock,84146631030.0,United States,Technology,Computer Software: Prepackaged Software
BTI,British American Tobacco  Industries p.l.c. Common Stock ADR,84027505809.0,United Kingdom,Health Care, Medicinal Chemicals and Botanical Products 
CMG,Chipotle Mexican Grill Inc. Common Stock,83826721360.0,United States,Consumer Discretionary,Restaurants
MSI,Motorola Solutions Inc. Common Stock,83510162821.0,United States,Technology,Radio And Television Broadcasting And Communications Equipment
USB,U.S. Bancorp Common Stock,83134090092.0,United States,Finance,Major Banks
HCA,HCA Healthcare Inc. Common Stock,82883877062.0,United States,Health Care,Hospital/Nursing Management
REGN,Regeneron Pharmaceuticals Inc. Common Stock,82441323947.0,United States,Health Care,Biotechnology: Pharmaceutical Preparations
ITW,Illinois Tool Works Inc. Common Stock,81951656000.0,United States,Industrials,Industrial Machinery/Components
MAR,Marriott International Class A Common Stock,80336212257.0,United States,Consumer Discretionary,Hotels/Resorts
MRVL,Marvell Technology Inc. Common Stock,80288078000.0,United States,Technology,Semiconductors
CEG,Constellation Energy Corporation Common Stock ,80243398639.0,United States,Utilities,Electric Utilities: Central
MCK,McKesson Corporation Common Stock,79781850965.0,United States,Health Care,Other Pharmaceuticals
BP,BP p.l.c. Common Stock,79467788234.0,United Kingdom,Energy,Integrated oil Companies
ZTS,Zoetis Inc. Class A Common Stock,79066668178.0,United States,Health Care,Biotechnology: Pharmaceutical Preparations
CL,Colgate-Palmolive Company Common Stock,78947768775.0,United States,Consumer Discretionary,Package Goods/Cosmetics
SCCO,Southern Copper Corporation Common Stock,78828956963.0,United States,Basic Materials,Metal Mining
RIO,Rio Tinto Plc Common Stock,78720841788.0,Australia,Basic Materials,Metal Mining
MSTR,MicroStrategy Incorporated Common Stock Class A,78518559798.0,United States,Technology,Computer Software: Prepackaged Software
GD,General Dynamics Corporation Common Stock,78093837482.0,United States,Industrials,Marine Transportation
EMR,Emerson Electric Company Common Stock,75608520000.0,United States,Technology,Consumer Electronics/Appliances
CVS,CVS Health Corporation Common Stock,75315697553.0,United States,Consumer Staples,Retail-Drug Stores and Proprietary Stores
DASH,DoorDash Inc. Class A Common Stock,74970713215.0,United States,Consumer Discretionary,Business Services
EOG,EOG Resources Inc. Common Stock,74952141770.0,United States,Energy,Oil & Gas Production
EPD,Enterprise Products Partners L.P. Common Stock,74629606079.0,United States,Utilities,Natural Gas Distribution
APD,Air Products and Chemicals Inc. Common Stock,74347940646.0,United States,Industrials,Major Chemicals
COIN,Coinbase Global Inc. Class A Common Stock,74153801217.0,United States,Finance,Finance: Consumer Services
FDX,FedEx Corporation Common Stock,73949382849.0,United States,Consumer Discretionary,Air Freight/Delivery Services
COF,Capital One Financial Corporation Common Stock,73253799615.0,United States,Finance,Major Banks
TRI,Thomson Reuters Corp Common Shares,73118773422.0,United States,Consumer Discretionary,Publishing
FTNT,Fortinet Inc. Common Stock,72851328945.0,United States,Technology,Computer peripheral equipment
MMM,3M Company Common Stock,72714910793.0,United States,Health Care,Medical/Dental Instruments
CNQ,Canadian Natural Resources Limited Common Stock,72195824560.0,Canada,Energy,Oil & Gas Production
ORLY,O'Reilly Automotive Inc. Common Stock,71771952151.0,United States,Consumer Discretionary,Auto & Home Supply Stores
CP,Canadian Pacific Kansas City Limited Common Shares,71468054090.0,Canada,Industrials,Railroads
SAN,Banco Santander S.A. Sponsored ADR (Spain),71446703693.0,Spain,Finance,Commercial Banks
NOC,Northrop Grumman Corporation Common Stock,71339724210.0,United States,Industrials,Industrial Machinery/Components
WMB,Williams Companies Inc. (The) Common Stock,71336570419.0,United States,Utilities,Natural Gas Distribution
EQNR,Equinor ASA,71203647422.0,Norway,Energy,Integrated oil Companies
GSK,GSK plc American Depositary Shares (Each representing two Ordinary Shares),70735923580.0,United Kingdom,Health Care,Biotechnology: Pharmaceutical Preparations
CSX,CSX Corporation Common Stock,70483720042.0,United States,Industrials,Railroads
TDG,Transdigm Group Incorporated Common Stock,70455064431.0,United States,Industrials,Military/Government/Technical
ECL,Ecolab Inc. Common Stock,70442165215.0,United States,Consumer Discretionary,Package Goods/Cosmetics
CNI,Canadian National Railway Company Common Stock,70308855000.0,Canada,Industrials,Railroads
BNS,Bank Nova Scotia Halifax Pfd 3 Ordinary Shares,70110058421.0,Canada,Finance,Major Banks
CRH,CRH PLC Ordinary Shares,69570525748.0,Ireland,Industrials,Building Materials
BMO,Bank Of Montreal Common Stock,69476624064.0,Canada,Finance,Commercial Banks
CARR,Carrier Global Corporation Common Stock ,69418480921.0,United States,Industrials,Industrial Machinery/Components
TEAM,Atlassian Corporation Class A Common Stock,68645028983.0,Australia,Technology,Computer Software: Prepackaged Software
AJG,Arthur J. Gallagher & Co. Common Stock,68505456000.0,United States,Finance,Specialty Insurers
RSG,Republic Services Inc. Common Stock,68361103867.0,United States,Utilities,Environmental Services
ET,Energy Transfer LP Common Units ,67998982028.0,United States,Utilities,Natural Gas Distribution
DEO,Diageo plc Common Stock,66396681900.0,United Kingdom,Consumer Staples,Beverages (Production/Distribution)
OKE,ONEOK Inc. Common Stock,66363324098.0,United States,Utilities,Oil & Gas Production
WDAY,Workday Inc. Class A Common Stock,66247350000.0,United States,Technology,EDP Services
RCL,Royal Caribbean Cruises Ltd. Common Stock,65621691074.0,United States,Consumer Discretionary,Marine Transportation
SE,Sea Limited American Depositary Shares each representing one Class A Ordinary Share,65359892797.0,United States,Consumer Discretionary,Other Consumer Services
DLR,Digital Realty Trust Inc. Common Stock,64912839868.0,United States,Real Estate,Real Estate Investment Trusts
MFG,Mizuho Financial Group Inc. Sponosred ADR (Japan),64479550797.0,Japan,Finance,Major Banks
BDX,Becton Dickinson and Company Common Stock,64138512554.0,United States,Health Care,Medical/Dental Instruments
FCX,Freeport-McMoRan Inc. Common Stock,63512204782.0,United States,Basic Materials,Metal Mining
TTD,The Trade Desk Inc. Class A Common Stock,63448926516.0,United States,Technology,Computer Software: Programming Data Processing
AFL,AFLAC Incorporated Common Stock,63330239538.0,United States,Finance,Accident &Health Insurance
TFC,Truist Financial Corporation Common Stock,63296183352.0,United States,Finance,Major Banks
KMI,Kinder Morgan Inc. Common Stock,62805766899.0,United States,Utilities,Natural Gas Distribution
ADSK,Autodesk Inc. Common Stock,62758500000.0,United States,Technology,Computer Software: Prepackaged Software
NSC,Norfolk Southern Corporation Common Stock,62408210763.0,United States,Industrials,Railroads
PCG,Pacific Gas & Electric Co. Common Stock,62287116162.0,United States,Utilities,Power Generation
NGG,National Grid Transco PLC National Grid PLC (NEW) American Depositary Shares,62227822749.0,United Kingdom,Utilities,Natural Gas Distribution
SLB,Schlumberger N.V. Common Stock,62050059854.0,France,Energy,Oilfield Services/Equipment
